web-scraper-order,web-scraper-start-url,link,link-href,pages,pages-href,product_name,product_price,brand
"1747136944-75","https://www.marksandspencer.com/l/men/mens-shirts","£42M&S Collection2pk Regular Fit Easy Iron Check Shirts","https://www.marksandspencer.com/2pk-regular-fit-easy-iron-check-shirts/p/clp60707155#intid=pid_pg1pip48g4r6c2","","","2pk Regular Fit Easy Iron Check Shirts","£42","M&S Collection"
"1747136951-76","https://www.marksandspencer.com/l/men/mens-shirts","£40M&S CollectionCotton Rich Overshirt","https://www.marksandspencer.com/cotton-rich-overshirt/p/clp60707664?color=DARKNAVY#intid=pid_pg1pip48g4r6c1","","","Cotton Rich Overshirt","£40","M&S Collection"
"1747136958-77","https://www.marksandspencer.com/l/men/mens-shirts","£49M&S Collection3pk Slim Fit Easy Iron Shirts","https://www.marksandspencer.com/3pk-slim-fit-easy-iron-long-sleeve-shirts/p/clp60576712#intid=pid_pg1pip48g4r5c4","","","3pk Slim Fit Easy Iron Shirts","£49","M&S Collection"
"1747136964-78","https://www.marksandspencer.com/l/men/mens-shirts","£40M&S CollectionCotton Rich Overshirt","https://www.marksandspencer.com/cotton-rich-overshirt/p/clp60707664?color=KHAKI#intid=pid_pg1pip48g4r5c3","","","Cotton Rich Overshirt","£40","M&S Collection"
"1747136970-79","https://www.marksandspencer.com/l/men/mens-shirts","£20M&S CollectionRegular Fit Cotton Blend Double Cuff Shirt","https://www.marksandspencer.com/regular-fit-easy-iron-cotton-blend-shirt/p/clp60630963#intid=pid_pg1pip48g4r5c2","","","Regular Fit Cotton Blend Double Cuff Shirt","£20","M&S Collection"
"1747136977-80","https://www.marksandspencer.com/l/men/mens-shirts","Offer£49M&S SARTORIALTailored Fit Luxury Cotton Twill Shirt","https://www.marksandspencer.com/tailored-fit-easy-iron-pure-cotton-shirt/p/clp60630952?color=WHITE#intid=pid_pg1pip48g4r5c1%7Cprodflag_Offer","","","Tailored Fit Luxury Cotton Twill Shirt","£49","M&S SARTORIAL"
"1747136983-81","https://www.marksandspencer.com/l/men/mens-shirts","£25M&S CollectionPure Cotton Ultimate Oxford Shirt","https://www.marksandspencer.com/pure-cotton-oxford-shirt/p/clp60708918?color=CHAMBRAY#intid=pid_pg1pip48g4r4c4","","","Pure Cotton Ultimate Oxford Shirt","£25","M&S Collection"
"1747136989-82","https://www.marksandspencer.com/l/men/mens-shirts","Offer£49M&S SARTORIALSlim Fit Luxury Cotton Double Cuff Twill Shirt","https://www.marksandspencer.com/slim-fit-easy-iron-pure-cotton-twill-shirt/p/clp60631004?color=WHITE#intid=pid_pg1pip48g4r4c3%7Cprodflag_Offer","","","Slim Fit Luxury Cotton Double Cuff Twill Shirt","£49","M&S SARTORIAL"
"1747136994-83","https://www.marksandspencer.com/l/men/mens-shirts","Offer£49M&S SARTORIALRegular Fit Luxury Cotton Twill Shirt","https://www.marksandspencer.com/regular-fit-easy-iron-pure-cotton-shirt/p/clp60630987?color=WHITE#intid=pid_pg1pip48g4r4c2%7Cprodflag_Offer","","","Regular Fit Luxury Cotton Twill Shirt","£49","M&S SARTORIAL"
"1747137000-84","https://www.marksandspencer.com/l/men/mens-shirts","Offer£45M&S SARTORIALSlim Fit Luxury Cotton Double Cuff Dress Shirt","https://www.marksandspencer.com/slim-fit-easy-iron-pure-cotton-dinner-shirt/p/clp60542511#intid=pid_pg1pip48g4r4c1%7Cprodflag_Offer","","","Slim Fit Luxury Cotton Double Cuff Dress Shirt","£45","M&S SARTORIAL"
"1747137005-85","https://www.marksandspencer.com/l/men/mens-shirts","£40M&S CollectionSlim Fit Ultimate Non Iron Cotton Shirt","https://www.marksandspencer.com/slim-fit-non-iron-pure-cotton-shirt/p/clp60707308?color=WHITE#intid=pid_pg1pip48g4r3c4","","","Slim Fit Ultimate Non Iron Cotton Shirt","£40","M&S Collection"
"1747137011-86","https://www.marksandspencer.com/l/men/mens-shirts","Offer£49M&S SARTORIALRegular Fit Luxury Cotton Double Cuff Twill Shirt","https://www.marksandspencer.com/regular-fit-easy-iron-pure-cotton-twill-shirt/p/clp60631018?color=WHITE#intid=pid_pg1pip48g4r3c3%7Cprodflag_Offer","","","Regular Fit Luxury Cotton Double Cuff Twill Shirt","£49","M&S SARTORIAL"
"1747137016-87","https://www.marksandspencer.com/l/men/mens-shirts","Offer£45M&S SARTORIALSlim Fit Luxury Cotton Double Cuffed Dress Shirt","https://www.marksandspencer.com/slim-fit-easy-iron-pure-cotton-textured-shirt/p/clp60694303#intid=pid_pg1pip48g4r3c2%7Cprodflag_Offer","","","Slim Fit Luxury Cotton Double Cuffed Dress Shirt","£45","M&S SARTORIAL"
"1747137022-88","https://www.marksandspencer.com/l/men/mens-shirts","Offer£49M&S SARTORIALSlim Fit Luxury Cotton Twill Shirt","https://www.marksandspencer.com/slim-fit-easy-iron-pure-cotton-twill-shirt/p/clp60630912?color=WHITE#intid=pid_pg1pip48g4r3c1%7Cprodflag_Offer","","","Slim Fit Luxury Cotton Twill Shirt","£49","M&S SARTORIAL"
"1747137027-89","https://www.marksandspencer.com/l/men/mens-shirts","£45M&S Collection3pk Regular Fit Easy Iron Short Sleeve Shirts","https://www.marksandspencer.com/3-pack-regular-fit-poplin-easy-to-iron-shirts/p/clp60287443#intid=pid_pg1pip48g4r2c4","","","3pk Regular Fit Easy Iron Short Sleeve Shirts","£45","M&S Collection"
"1747137034-90","https://www.marksandspencer.com/l/men/mens-shirts","£45M&S CollectionRegular Fit Pure Linen Shirt","https://www.marksandspencer.com/pure-linen-shirt/p/clp60723644?color=WHITE#intid=pid_pg1pip48g4r2c3","","","Regular Fit Pure Linen Shirt","£45","M&S Collection"
"1747137039-91","https://www.marksandspencer.com/l/men/mens-shirts","Offer£45M&S SARTORIALRegular Fit Luxury Cotton Double Cuff Dress Shirt","https://www.marksandspencer.com/regular-fit-pure-cotton-dinner-shirt/p/clp60542508?color=WHITE#intid=pid_pg1pip48g4r2c2%7Cprodflag_Offer","","","Regular Fit Luxury Cotton Double Cuff Dress Shirt","£45","M&S SARTORIAL"
"1747137045-92","https://www.marksandspencer.com/l/men/mens-shirts","£49M&S Collection3pk Regular Fit Easy Iron Long Sleeve Shirts","https://www.marksandspencer.com/3pk-regular-fit-easy-iron-long-sleeve-shirts/p/clp60576693#intid=pid_pg1pip48g4r2c1","","","3pk Regular Fit Easy Iron Long Sleeve Shirts","£49","M&S Collection"
"1747137050-93","https://www.marksandspencer.com/l/men/mens-shirts","£45AutographTailored Fit Stretch Performance Shirt","https://www.marksandspencer.com/tailored-fit-stretch-performance-shirt/p/clp60711791?color=SMOKEYGREEN#intid=pid_pg1pip48g4r1c4","","","Tailored Fit Stretch Performance Shirt","£45","Autograph"
"1747137057-94","https://www.marksandspencer.com/l/men/mens-shirts","£45AutographTailored Fit Stretch Performance Shirt","https://www.marksandspencer.com/tailored-fit-stretch-performance-shirt/p/clp60711791?color=PINK#intid=pid_pg1pip48g4r1c3","","","Tailored Fit Stretch Performance Shirt","£45","Autograph"
"1747137062-95","https://www.marksandspencer.com/l/men/mens-shirts","£45AutographTailored Fit Stretch Performance Shirt","https://www.marksandspencer.com/tailored-fit-stretch-performance-shirt/p/clp60711791?color=BLACK#intid=pid_pg1pip48g4r1c2","","","Tailored Fit Stretch Performance Shirt","£45","Autograph"
"1747137069-96","https://www.marksandspencer.com/l/men/mens-shirts","£45AutographTailored Fit Stretch Performance Shirt","https://www.marksandspencer.com/tailored-fit-stretch-performance-shirt/p/clp60711791?color=AIRFORCEBLUE#intid=pid_pg1pip48g4r1c1","","","Tailored Fit Stretch Performance Shirt","£45","Autograph"
