pdp_url,prices,product_id,product_description,color,product_type
https://www.pullandbear.com/ae/printed-short-sleeve-sweatshirt-l07150704,149.00,692151886,"Short sleeve sweatshirt with a blue print, a 'Dynamic Blue Edition' slogan and a round neck.",['Off white'],Clothing
https://www.pullandbear.com/ae/white-tshirt-with-cactus-illustration-l07150703,119.00,692151897,White short sleeve T-shirt with a contrast cactus graphic and round neck. Made of cotton.,['Off white'],Clothing
https://www.pullandbear.com/ae/stwd-tshirt-with-an-apple-graphic-l07150718,99.00,701560410,Short sleeve T-shirt with an apple graphic and text on the back and text on the front and a crew neck. Made of cotton.,['Off white'],Clothing
https://www.pullandbear.com/ae/stwd-tshirt-with-strawberry-graphic-l07150715,99.00,701560411,"Pink short sleeve T-shirt with a strawberry graphic and text on the front and back, and a crew neck. Made of cotton.",['Pink'],Clothing
https://www.pullandbear.com/ae/house-graphic-tshirt-l07150728,99.00,701560412,"Short sleeve T-shirt with a round neck, featuring a house graphic and text print on the front and back. Made of cotton.",['Anthracite grey'],Clothing
https://www.pullandbear.com/ae/black-tshirt-with-graphic-and-text-l07150727,99.00,701560413,"Black short sleeve T-shirt with a round neck, featuring a graphic and text on the back and text on the front. Made from a cotton blend.",['Black'],Clothing
https://www.pullandbear.com/ae/island-graphic-tshirt-l07150724,99.00,701560414,White short sleeve crew neck T-shirt with an island graphic and slogan on the back and slogan on the front. Made of cotton.,['Off white'],Clothing
https://www.pullandbear.com/ae/white-scarface-tshirt-l07150739,129.00,705928799,"White Scarface licensed T-shirt with a contrasting graphic and text, short sleeves, a round neck, and made of cotton.",['White'],Clothing
https://www.pullandbear.com/ae/stwd-tshirt-with-cherry-graphic-l07150723,99.00,701560409,"Black short sleeve T-shirt with a cherry graphic and text on the back, a logo on the front, a round neck, and made from a cotton blend.",['Black'],Clothing
https://www.pullandbear.com/ae/boxy-fit-createur-tshirt-l07150584,99.00,692151911,"Boxy-fit T-shirt with short sleeves, a crew neck and slogan graphic on the front and back. Made of 100% cotton.",['Wine'],Clothing
https://www.pullandbear.com/ae/stwd-football-tshirt-with-polo-collar-l07200507,189.00,692151912,"Soccer T-shirt with an STWD logo, graphic on the front and back, polo collar and short sleeves.",['Wine'],Clothing
https://www.pullandbear.com/ae/guns-n-roses-tshirt-l07150920,129.00,692151971,Guns N’ Roses license washed effect grey sleeveless T-shirt with a round neck.,['Anthracite grey'],Clothing
https://www.pullandbear.com/ae/softtouch-boxyfit-tshirt-l03248506,99.00,692151972,Boxy fit T-shirt with short sleeves and a round neck. Made of 100% cotton.,"['White', 'Grey', 'Mulberry', 'Chocolate']",Clothing
https://www.pullandbear.com/ae/faded-stwd-tshirt-l07151502,99.00,692151982,"Washed effect T-shirt with STWD embroidery, a round neck and short sleeves.",['Anthracite grey'],Clothing
https://www.pullandbear.com/ae/double-short-sleeve-tshirt-with-logo-l07247700,75.00,701517487,"Short sleeve T-shirt with a contrast double hem, a logo on the front and a round neck. Made of cotton.","['White', 'Blue', 'Green', 'Black']",Clothing
https://www.pullandbear.com/ae/imagine-dragons-brown-tshirt-l07150928,129.00,692151987,"Brown Imagine Dragons license T-shirt with a contrast graphic on the front and back, short sleeves and a round neck. Made of cotton.",['Brown'],Clothing
https://www.pullandbear.com/ae/ripped-vest-top-l07151501,99.00,692151988,Round neck vest top with ripped detailing on the hem.,['Black'],Clothing
https://www.pullandbear.com/ae/distressed-short-sleeve-tshirt-l07151503,99.00,692151983,"Distressed short sleeve T-shirt with a round neck, a contrast STWD graphic and a central seam detail. Made of 100% cotton.",['Grey'],Clothing
https://www.pullandbear.com/ae/pink-squid-game-tshirt-l07150450,129.00,705234609,"Pink The Squid Game license T-shirt with a graphic on the front and back, short sleeves and a round neckline. Made of 100% cotton.",['Pink'],Clothing
https://www.pullandbear.com/ae/squid-game-tshirt-l07150449,169.00,705234608,"Squid Game license T-shirt with a slogan graphic on the front and back, short sleeves and a round collar.",['Grey'],Clothing
https://www.pullandbear.com/ae/striped-short-sleeve-tshirt-l03245765,99.00,701517500,Short sleeve T-shirt with a striped design and a round neck. Made of a cotton blend.,['White'],Clothing
https://www.pullandbear.com/ae/black-striped-tshirt-l03245764,99.00,701517501,Black short sleeve T-shirt with a striped design and a round neck. Made of cotton.,['Black'],Clothing
https://www.pullandbear.com/ae/one-piece-hockey-tshirt-l03245564,149.00,701517502,One Piece license hockey-style T-shirt with a contrast graphic on the front and a V-neck. Made of 100% cotton.,['Off white'],Clothing
https://www.pullandbear.com/ae/short-sleeve-honda-tshirt-l03245599,119.00,701517503,"Honda license T-shirt with short sleeves, a round neck and a contrast graphic. Made of 100% cotton.",['Black'],Clothing
https://www.pullandbear.com/ae/short-sleeve-stwd-tshirt-l03248549,99.00,701517504,Short sleeve T-shirt with an STWD logo on the front and a round neck. Made of cotton.,"['Navy', 'Pale marl']",Clothing
https://www.pullandbear.com/ae/short-sleeve-tshirt-with-stwd-graffiti-graphic-l03248575,129.00,701517506,Short sleeve T-shirt with an STWD graphic and a round neck. Made of cotton.,"['Anthracite grey', 'Brown']",Clothing
https://www.pullandbear.com/ae/honda-tshirt-l03245519,119.00,701517508,"White short sleeve Honda license T-shirt with a round neck, a graphic on the front and a theme print on the back. Made of 100% cotton.",['White'],Clothing
https://www.pullandbear.com/ae/stwd-graffiti-graphic-tshirt-l03248908,129.00,701517509,Short sleeve T-shirt with a graffiti-style STWD graphic and a round neck. Made of cotton.,['White'],Clothing
https://www.pullandbear.com/ae/short-sleeve-textured-tshirt-l07150505,99.00,692152009,Short sleeve T-shirt with a round neck. Available in a range of colours and made of cotton.,"['Mustard', 'Off white', 'Blue', 'Black', 'Green', 'Navy']",Clothing
https://www.pullandbear.com/ae/short-sleeve-ribbed-tshirt-with-voluminous-graphic-l07151705,99.00,701009649,"Short sleeve T-shirt with contrasting ribbed trims, a voluminous graphic and a round neck.",['Off white'],Clothing
https://www.pullandbear.com/ae/mesh-tshirt-with-graphic-l07151704,189.00,701009650,"Mesh T-shirt with a contrast graphic, round neck and short sleeves.",['Khaki'],Clothing
https://www.pullandbear.com/ae/short-sleeve-sweatshirt-with-graphic-l07151703,149.00,701009651,"Short sleeve sweatshirt with a contrast graphic and volume detailing, with a round neck and made of cotton.",['Mustard'],Clothing
https://www.pullandbear.com/ae/embroidered-raglan-sleeve-tshirt-l07151702,99.00,701009652,"T-shirt with short raglan sleeves, a contrast embroidered graphic and a round neck. Made from cotton.",['Mustard'],Clothing
https://www.pullandbear.com/ae/white-short-sleeve-tshirt-l07152733,99.00,708689703,White short sleeve round neck T-shirt. Made of cotton.,['Off white'],Clothing
https://www.pullandbear.com/ae/black-short-sleeve-tshirt-l07152734,99.00,708689704,Black short sleeve T-shirt with a crew neck and made of cotton.,['Black'],Clothing
https://www.pullandbear.com/ae/embroidered-ay-carmela-tshirt-l07150586,99.00,692152107,"Ay Carmela license T-shirt with short sleeves, a crew neck and embroidered graphic on the front. Made of 100% cotton.",['Red'],Clothing
https://www.pullandbear.com/ae/stwd-tshirt-with-embroidered-detail-l07151906,99.00,701724490,Blue short sleeve T-shirt with a contrast embroidered detail. Made of cotton.,['Deep blue'],Clothing
https://www.pullandbear.com/ae/short-sleeve-star-wars-sweatshirt-l07151716,169.00,710733668,"Short sleeve sweatshirt with a Star Wars license, a contrast graphic and text, and a crew neck. Made of cotton.",['Anthracite grey'],Clothing
https://www.pullandbear.com/ae/white-star-wars-tshirt-l07152741,119.00,710733669,"White official Star Wars T-shirt with a contrast graphic and text, short sleeves and a round neck. Made of cotton.",['Off white'],Clothing
https://www.pullandbear.com/ae/grey-star-wars-tshirt-l07152740,199.00,710733670,"Grey Star Wars license T-shirt with a contrast graphic and text, short sleeves and a round neck.",['Anthracite grey'],Clothing
https://www.pullandbear.com/ae/natures-playground-tshirt-l07150507,99.00,692152164,"T-shirt with a contrast dolmen graphic and Nature's Playground slogan, short sleeves and a round neck. Made of cotton.",['Ochre'],Clothing
https://www.pullandbear.com/ae/basic-muscle-fit-tshirt-l03245502,59.00,692152196,MUSCLE FIT. Basic T-shirt with short sleeves and a round neckline. Available in several plain colours. Made of 100% cotton.,"['White', 'Black', 'Green', 'Pale marl']",Clothing
https://www.pullandbear.com/ae/basic-short-sleeve-sweatshirt-l07560500,129.00,692152209,Basic short sleeve sweatshirt with a round neck. Made of slightly stretchy fabric.,"['Sky blue', 'Pale brown', 'Pink', 'Khaki', 'Off white', 'Black']",Clothing
https://www.pullandbear.com/ae/stwd-error-404-tshirt-l07152501,59.00,696614820,"Short sleeve STWD T-shirt with a round neck, with a graphic on the front and back. Made of 100% cotton.",['Green'],Clothing
https://www.pullandbear.com/ae/ghost-mode-stwd-tshirt-l07152504,59.00,696614822,"STWD T-shirt with short sleeves and a round neck, with a graphic on the front and back. Made of 100% cotton.",['Off white'],Clothing
https://www.pullandbear.com/ae/washed-sleeveless-tshirt-l03248513,99.00,692152231,Sleeveless T-shirt with a crew neck and ripped details. Made of 100% washed cotton.,"['Chocolate', 'Green', 'Black', 'Off white']",Clothing
https://www.pullandbear.com/ae/stwd-street-school-tshirt-l07152503,59.00,696614823,Short sleeve STWD T-shirt with a round neck and a graphic on the front and back. Made of 100% cotton.,['Pearl grey'],Clothing
https://www.pullandbear.com/ae/stwd-off-the-radar-tshirt-l07152502,59.00,696614825,STWD short sleeve T-shirt with a round neck and a graphic on the front and back. Made of 100% cotton fabric.,['Pink'],Clothing
https://www.pullandbear.com/ae/peanuts-snoopy-tshirt-l07152719,119.00,701974443,"Peanuts license T-shirt with a Snoopy graphic, a round neck with contrast rib and short sleeves.",['White'],Clothing
https://www.pullandbear.com/ae/peanuts-snoopy-tshirt-l07152718,119.00,701974444,"Peanuts license T-shirt with a Snoopy golf graphic, red flocked text, a round neck and short sleeves.",['Navy'],Clothing
https://www.pullandbear.com/ae/snoopy-blue-mesh-tshirt-l07152717,189.00,701974445,"Snoopy license blue T-shirt with short sleeves, a contrast Peanuts graphic, a V-neck and made of mesh.",['Blue'],Clothing
https://www.pullandbear.com/ae/stwd-tshirt-with-contrast-ribbed-trims-l07150916,99.00,694017959,Short sleeve crew neck T-shirt with an “STWD Design” graphic and contrast ribbed detail.,['Off white'],Clothing
https://www.pullandbear.com/ae/tank-rib-tshirt-l03248502,75.00,692152253,Tank top with a crew neck. Available in several colours.,"['White', 'Black']",Clothing
https://www.pullandbear.com/ae/grey-tshirt-with-graphic-l07150707,99.00,696614850,Grey short sleeve T-shirt with a contrast graphic and round neck. Made of cotton.,['Anthracite grey'],Clothing
https://www.pullandbear.com/ae/paris-tshirt-l07151559,99.00,696066028,"Short sleeve crew neck T-shirt, with graphic on the front and back. Made from 100% cotton.",['Sand'],Clothing
https://www.pullandbear.com/ae/short-sleeve-tshirt-with-croissant-graphic-l07151558,99.00,696066029,Short sleeve round neck T-shirt with a graphic on the front and back. Made of 100% cotton.,['White'],Clothing
https://www.pullandbear.com/ae/paris-macarons-tshirt-l07151561,99.00,696066030,"Short sleeve T-shirt with a round neck, with a front and back graphic. Made of 100% cotton.",['Blue'],Clothing
https://www.pullandbear.com/ae/striped-tshirt-paris-menu-l07151560,99.00,696066031,"Striped T-shirt with short sleeves and a round neck, with a menu graphic on the front.",['White'],Clothing
https://www.pullandbear.com/ae/honda-nsxr-tshirt-l07152916,129.00,696066034,"Honda license T-shirt in dark grey with an NSX-R car graphic on the front and back, a round neck and short sleeves.",['Black'],Clothing
https://www.pullandbear.com/ae/honda-polo-collar-tshirt-l07152519,199.00,696066035,"Honda license football style short sleeve T-shirt with a striped design, contrast graphic and polo collar.",['Green/Ecru'],Clothing
https://www.pullandbear.com/ae/white-tshirt-with-embroidery-l07150912,99.00,692152308,"Short sleeve T-shirt with embroidery on the front, appliqués on the back and a round neck.",['Off white'],Clothing
https://www.pullandbear.com/ae/orange-honda-tshirt-l07152518,129.00,696066037,"Orange short sleeve Honda license T-shirt with a contrast graphic, round neck and made of 100% cotton.",['Orange'],Clothing
https://www.pullandbear.com/ae/white-tshirt-with-contrast-embroidery-l07150710,99.00,692152310,White short sleeve T-shirt with contrast embroidery and a round neck. Made of cotton.,['Off white'],Clothing
https://www.pullandbear.com/ae/new-york-city-tshirt-l07150919,99.00,693518327,"White T-shirt with a flocked ‘New York City’ slogan, contrast ribbing on the round neck and short sleeves.",['Off white'],Clothing
https://www.pullandbear.com/ae/honda-nsx-tshirt-l07152521,129.00,696066036,"Honda license short sleeve T-shirt with a NSX car graphic on the front and back, a round neck and made of 100% cotton.",['Grey marl'],Clothing
https://www.pullandbear.com/ae/honda-panel-tshirt-l07152517,129.00,696066038,"Honda license short sleeve T-shirt with a panel design, round neck and made of 100% cotton.",['Off white'],Clothing
https://www.pullandbear.com/ae/honda-integra-tshirt-l07152917,129.00,696066033,"Honda license T-shirt with an Integra Type R car graphic on the back, a round neck and short sleeves.",['Beige'],Clothing
https://www.pullandbear.com/ae/honda-civic-rally-tshirt-l07152920,129.00,696066044,"Honda license T-shirt with a graphic of the Honda Civic Rally car on the back, round neck and short sleeve.",['Off white'],Clothing
https://www.pullandbear.com/ae/honda-football-tshirt-l07152919,199.00,696066045,"Brown Honda licensed football-style T-shirt with a front logo, a V-neck and short sleeves.",['Brown'],Clothing
https://www.pullandbear.com/ae/honda-civic-tshirt-l07152918,129.00,696066046,"Honda license T-shirt featuring a Honda Civic Type R car graphic on the front and back, with a crew neck and short sleeves.",['Off white'],Clothing
https://www.pullandbear.com/ae/washed-stwd-polo-shirt-l07200508,189.00,693840130,Short sleeve polo shirt in black with a washed finish and a contrast STWD logo on the front. Made of cotton.,['Black'],Clothing
https://www.pullandbear.com/ae/knit-polo-shirt-with-embroidered-slogan-l07200506,149.00,692156938,"Knit polo shirt with short sleeves, a Kent collar and a ""Crave Joy"" slogan embroidered on the front.",['Off white'],Clothing
https://www.pullandbear.com/ae/stwd-star-polo-shirt-l07200502,169.00,692152207,Dark blue short sleeve boxy fit polo shirt with a contrast graphic on the front and back and a Kent collar. Made of a cotton blend.,['Blue'],Clothing
https://www.pullandbear.com/ae/striped-cutwork-polo-shirt-l07550500,189.00,692156968,Short sleeve polo shirt in cutwork fabric with a Kent collar and button detail on the collar. Made of a cotton blend.,['Pink'],Clothing
https://www.pullandbear.com/ae/striped-short-sleeve-polo-shirt-with-embroidery-l07200501,169.00,692161193,"Short sleeve polo shirt with a striped design, contrast embroidery and a Kent collar. Made of a cotton blend.",['Off white'],Clothing
https://www.pullandbear.com/ae/striped-peanuts-polo-shirt-l07152720,169.00,701974447,Striped licensed Peanuts short sleeve polo shirt with button fastening.,['Striped'],Clothing
https://www.pullandbear.com/ae/stwd-sporty-polo-shirt-l07550505,189.00,692151729,STWD sporty knit short sleeve polo shirt with stripe detail and 'Miglio Punteggio' embroidery.,"['Navy', 'Dark green']",Clothing
https://www.pullandbear.com/ae/boxy-fit-short-sleeve-polo-shirt-l07200505,149.00,692152246,Boxy fit short sleeve polo shirt with a Kent collar. Made of cotton.,"['Moss', 'Anthracite grey']",Clothing
https://www.pullandbear.com/ae/stwd-all-rights-reserved-polo-shirt-l07200504,169.00,692152250,"Boxy fit polo shirt with short sleeves, a contrast STWD graphic and a Kent collar. Made of cotton.",['Moss'],Clothing
https://www.pullandbear.com/ae/no-bad-days-polo-shirt-l07200901,169.00,692152251,"Boxy fit polo shirt with short sleeves, a No Bad Days graphic and slogan.",['Grey'],Clothing
https://www.pullandbear.com/ae/striped-mickey-mouse-polo-shirt-l07152737,189.00,709246523,"Mickey Mouse license long sleeve polo shirt with a striped design, a contrast graphic, and made of a cotton blend.",['Burgundy'],Clothing
https://www.pullandbear.com/ae/short-sleeve-knit-polo-shirt-l03558519,129.00,692151875,Short sleeve knit polo shirt with a Kent collar and button fastenings.,"['Cement', 'Off white', 'Black']",Clothing
https://www.pullandbear.com/ae/striped-knit-polo-l07550735,219.00,695434570,Short sleeve striped knit polo shirt with contrasting text.,"['Dark green', 'Sand']",Clothing
https://www.pullandbear.com/ae/short-sleeve-polo-shirt-l03203512,119.00,692152025,Short sleeve polo shirt with a Kent collar. Made of cotton.,"['Sand', 'Off white', 'Black']",Clothing
https://www.pullandbear.com/ae/textured-short-sleeve-polo-shirt-l07200500,149.00,692161653,Short sleeve polo shirt with a Kent collar. Made of 100% cotton.,"['Off white', 'Black']",Clothing
https://www.pullandbear.com/ae/linen-blend-joggers-l03680508,189.00,692161536,Joggers with an elasticated drawstring waistband and back pocket. Made of a linen (53%) and cotton (47%) blend.Total look.,"['Off white', 'Beige', 'Anthracite grey', 'Taupe']",Clothing
https://www.pullandbear.com/ae/cargo-joggers-l03680518,269.00,692157445,"Cargo sweatpants with a drawstring fastening, pockets and elastic hems.","['Khaki', 'Beige', 'Black', 'Dark grey']",Clothing
https://www.pullandbear.com/ae/jogging-trousers-l03680515,169.00,692157455,Joggers with an elastic drawstring waistband and pockets. Made of slightly stretchy cotton.,"['Black', 'Anthracite grey', 'White']",Clothing
https://www.pullandbear.com/ae/basic-zipup-hoodie-l07560501,189.00,692152348,"Basic zip-up hoodie with a hood, pouch pocket and made of a cotton blend.","['Grey marl', 'Black']",Clothing
https://www.pullandbear.com/ae/basic-quarterzip-sweatshirt-l07560502,169.00,692152366,Basic long sleeve sweatshirt with a high neck and zip fastening.,"['Black', 'Off white', 'Bottle', 'Bright turquoise', 'Navy', 'Grey marl', 'Anthracite grey']",Clothing
https://www.pullandbear.com/ae/rustic-tailored-fit-trousers-l03680545,269.00,692151869,"Tailored smart trousers in rustic fabric with front darts, belt loops and zip fly and top button fastening.",['Beige'],Clothing
https://www.pullandbear.com/ae/tailored-fit-jogger-trousers-l07674514,189.00,702129736,"Tailored fit jogger-style trousers with button and zip fastening, and pockets.",['Ecru'],Clothing
https://www.pullandbear.com/ae/round-neck-stwd-sweatshirt-l07560507,199.00,692161610,"Basic sweatshirt with STWD embroidery on the front, a round neck and long sleeves.","['Pink', 'Deep blue', 'Black', 'Off white']",Clothing
https://www.pullandbear.com/ae/baggy-tracksuit-bottoms-l07679500,169.00,700056166,"Baggy jogger tracksuit bottoms with a rubberised logo, side pockets and an elasticated drawstring waistband. Made of cotton.Total look.","['Anthracite grey', 'Black', 'Grey marl']",Clothing
https://www.pullandbear.com/ae/cargo-joggers-l07674500,189.00,697861749,"Cargo sweatpants with an elastic drawstring waistband, flap pockets and elastic hems.","['Khaki', 'Black', 'Ice', 'Anthracite grey', 'Ochre', 'Grey']",Clothing
https://www.pullandbear.com/ae/baggy-sweatpants-l07675501,169.00,693840148,"Baggy sweatpants with an elastic drawstring waistband, pockets and made of a cotton blend.","['Grey blue', 'Bottle', 'Black', 'Grey marl', 'Ice']",Clothing
https://www.pullandbear.com/ae/tailored-fit-wideleg-trousers-l07677509,219.00,693340448,"Wide-leg tailored fit smart trousers featuring front darts, belt loops and button and zip fly fastening.","['Grey', 'Ecru', 'Black', 'Khaki']",Clothing
https://www.pullandbear.com/ae/stwd-tracksuit-bottoms-l07675504,149.00,694195011,"STWD tracksuit jogger trousers, with an elastic drawstring waistband, pockets, and made of a cotton blend.","['Green', 'Mauve', 'Ice', 'Black', 'Off white', 'Anthracite grey', 'Navy']",Clothing
https://www.pullandbear.com/ae/technical-tracksuit-bottoms-l07678503,149.00,700653382,Technical tracksuit jogger trousers with side zip pockets and an elasticated drawstring waistband. Available in assorted colours. Made of stretchy interlock fabric.,"['Black', 'Sand', 'Anthracite grey']",Clothing
https://www.pullandbear.com/ae/interlock-tracksuit-bottoms-l03680524,169.00,700653384,Tracksuit jogger trousers in interlock fabric with pockets and an elasticated drawstring waistband. Made of cotton.Total look.,"['Black', 'Off white', 'Grey marl']",Clothing
https://www.pullandbear.com/ae/100-linen-joggers-l03680510,269.00,692152160,Baggy joggers made of 100% linen with pockets and an elasticated drawstring waistband.Total look.,"['White', 'Brown', 'Beige']",Clothing
https://www.pullandbear.com/ae/stwd-interlock-sweatpants-l03680525,169.00,694046097,"STWD sweatpants in interlock fabric, with pockets, and an elastic drawstring waistband.","['Grey marl', 'Anthracite grey', 'Black']",Clothing
https://www.pullandbear.com/ae/chinos-with-darts-l03680533,219.00,694046105,"Wide-leg chinos with belt loops, darts, zipper fly and top button fastening, and pockets.","['Taupe', 'Black']",Clothing
https://www.pullandbear.com/ae/rustic-joggers-l07675500,189.00,692161468,Crepe joggers with an elasticated drawstring waistband. Made of 100% cotton.Total look,"['Off white', 'Black', 'Ochre']",Clothing
https://www.pullandbear.com/ae/textured-weave-jogger-trousers-l03680511,119.00,692152266,Joggers with an elasticated drawstring waistband and pockets. Made of a textured cotton (77%) and linen (23%) blend.Total look.,"['Beige', 'Khaki']",Clothing
https://www.pullandbear.com/ae/comfort-joggers-l07674501,189.00,693518292,"Comfort fit joggers with an elastic drawstring waistband, elastic hems and pockets.","['Khaki', 'Brown', 'Black', 'Stone']",Clothing
https://www.pullandbear.com/ae/stwd-tracksuit-bottoms-l07678506,149.00,701515225,Tracksuit jogger trousers with an elasticated drawstring waistband and pockets. Made of fleece fabric.,"['Grey marl', 'Anthracite grey', 'Black']",Clothing
https://www.pullandbear.com/ae/comfort-cargo-trousers-l07674503,219.00,693518329,"Comfort fit cargo trousers with elasticated waist and hems, pockets and seam detail.","['Khaki', 'Black', 'Grey']",Clothing
https://www.pullandbear.com/ae/linen-blend-joggers-l03680509,219.00,692161533,Relaxed fit joggers with an elasticated drawstring waistband and front pockets. Made of a linen (51%) and viscose blend (49%).Total look.,"['Khaki', 'Black', 'White']",Clothing
https://www.pullandbear.com/ae/stwd-jogger-bermuda-shorts-l03696503,119.00,692161547,"Tracksuit jogger Bermuda shorts with STWD graphic detail, an elasticated waistband and drawstring.Total look.","['Black', 'Grey marl', 'White', 'Blue', 'Pink', 'Anthracite grey', 'Sky blue', 'Red', 'Mint']",Clothing
https://www.pullandbear.com/ae/floral-bermuda-shorts-with-frayed-hem-l07696517,219.00,704858132,"Printed Bermuda shorts with a five-pocket design, belt loops, button and zip fastening, frayed hem and made of 100% cotton.",['Faded red'],Clothing
https://www.pullandbear.com/ae/stwd-jogger-bermuda-sweatpants-l07696516,129.00,698625047,"Tracksuit-style Bermuda short sweatpants, available in various shades, with an STWD logo and an elastic waistband and drawstring.","['Anthracite grey', 'Grey marl', 'Black']",Clothing
https://www.pullandbear.com/ae/stwd-cargo-bermuda-shorts-l03696504,119.00,692161562,Cargo Bermuda shorts with an elasticated drawstring waistband and embroidered STWD logo. Made of 100% cotton.,"['Beige', 'Black']",Clothing
https://www.pullandbear.com/ae/comfort-cargo-bermuda-shorts-l03696510,119.00,692161565,Comfort fit cargo Bermuda shorts with an elastic drawstring waistband and pockets.,"['Black', 'Khaki', 'Stone']",Clothing
https://www.pullandbear.com/ae/interlock-jogger-bermuda-shorts-l03696518,149.00,692161568,Tracksuit jogger Bermuda shorts in interlock fabric with an elasticated drawstring waistband. Made of a cotton blend.,"['Black', 'Grey marl', 'Anthracite grey']",Clothing
https://www.pullandbear.com/ae/cargo-bermuda-shorts-l03696509,169.00,692161573,Cargo Bermuda shorts made of 100% cotton with pockets and an elasticated waistband with drawstring.,"['Dark green', 'Khaki', 'Ecru', 'Grey', 'Black']",Clothing
https://www.pullandbear.com/ae/baggy-jogger-bermuda-shorts-l07696502,75.00,692157480,Baggy tracksuit jogger Bermuda shorts with an elasticated drawstring waistband. Made of 100% cotton.Total look,"['Anthracite grey', 'Sand', 'Mulberry', 'Grey', 'Khaki']",Clothing
https://www.pullandbear.com/ae/washed-stwd-jogger-bermuda-shorts-l03696512,149.00,692161578,"Washed tracksuit-style jogger Bermuda shorts with pockets, an elasticated waistband with drawstring, ripped details on the front pockets and an embroidered STWD logo.Total look","['Black', 'Grey']",Clothing
