pdp_url,prices,product_id,product_description,color,product_type
https://www.pullandbear.com/ae/ripped-denim-bermuda-shorts-with-print-l03698545,269.00,699548204,"Baggy denim Bermuda shorts with a five-pocket design, belt loops and zip and button fastening.","['Pale blue', 'Faded black', 'Medium blue']",Clothing
https://www.pullandbear.com/ae/striped-linen-blend-jogger-bermuda-shorts-l03696501,169.00,692161580,"Jogger Bermuda shorts made of linen (52%) and cotton (48%), with a striped design, elasticated waistband and drawstring fastening.Total look.",['Striped'],Clothing
https://www.pullandbear.com/ae/diagonal-textured-jogger-bermuda-shorts-l03696514,129.00,692161583,Tracksuit jogger Bermuda shorts in diagonal textured fabric with side pockets and an elasticated waistband with drawstring. Made of 100% cotton.Total look.,"['Off white', 'Black', 'Grey']",Clothing
https://www.pullandbear.com/ae/linen-blend-jogger-bermuda-shorts-l03696500,169.00,692161587,"Jogger Bermuda shorts made of linen (53%) and cotton (47%), with an elasticated waistband and drawstring fastening.Total look.","['Off white', 'Beige', 'Anthracite grey', 'Mint', 'Grey', 'Navy']",Clothing
https://www.pullandbear.com/ae/basic-bermuda-shorts-with-drawstrings-l03696507,149.00,692161591,Basic trunk-style Bermuda shorts with an elastic drawstring waistband and pockets. Made of slightly stretchy cotton.,"['Black', 'Khaki', 'Sand']",Clothing
https://www.pullandbear.com/ae/denim-skater-bermuda-shorts-l07698504,269.00,692157497,"Denim skater Bermuda shorts with contrast seams, a five-pocket design, belt loops and zip and button fastening. Made of cotton.",['Medium blue'],Clothing
https://www.pullandbear.com/ae/rustic-jogger-bermuda-shorts-l03696532,189.00,692156986,Bermuda short sweatpants made of rustic fabric with an elasticated waistband and pockets.,['Grey'],Clothing
https://www.pullandbear.com/ae/baggy-denim-bermuda-shorts-l07696506,99.00,692156952,"Baggy denim Bermuda shorts with a five-pocket design, belt loops and zip and button fastening. Made of cotton.","['Khaki', 'Grey', 'Beige']",Clothing
https://www.pullandbear.com/ae/stwd-super-baggy-denim-bermuda-shorts-l07698509,269.00,692157007,"Super baggy denim Bermuda shorts with a five-pocket design, belt loops, a zipper fly and top button fastening and an STWD graphic on the front. Made of 100% cotton.",['Pale indigo'],Clothing
https://www.pullandbear.com/ae/skater-jorts-l07696508,169.00,692161618,"Skater jorts with belt loops, a five-pocket design and zip and button fastening. Made of 100% cotton.",['Off white'],Clothing
https://www.pullandbear.com/ae/2pack-of-stwd-jogger-bermuda-shorts-l03696902,229.00,692161624,"Pack of 2 tracksuit jogger Bermuda shorts with pockets, an elasticated waistband, drawstring fastening and STWD logo.","['White/Black', 'Blue', 'Grey marl', 'Anthracite grey']",Clothing
https://www.pullandbear.com/ae/ripped-slimfit-denim-bermuda-shorts-l03697509,169.00,692151900,"Slim fit denim Bermuda shorts with ripped details, belt loops, zip fly and top button fastening and pockets.","['Ecru', 'Faded black', 'Neon blue', 'Pale indigo', 'Medium blue', 'Black']",Clothing
https://www.pullandbear.com/ae/denim-cargo-bermuda-shorts-l03698506,189.00,692152410,"Denim cargo Bermuda shorts made of 100% cotton with pockets, belt loops and zip and button fastening.","['Dark grey', 'Pale indigo', 'Black', 'Medium blue']",Clothing
https://www.pullandbear.com/ae/ripped-straight-fit-denim-bermuda-shorts-l03697504,189.00,692152415,"Straight fit denim Bermuda shorts with ripped details, belt loops, pockets and zip and button fastening.","['Medium blue', 'Pale indigo', 'Dark grey', 'Black', 'White']",Clothing
https://www.pullandbear.com/ae/standard-denim-bermuda-shorts-l03687513,169.00,692152419,"Standard fit denim Bermuda shorts with ripped details, belt loops, pockets and zip and button fastening.","['Black', 'Faded black', 'Ecru', 'Pale indigo', 'Neon blue', 'Medium blue', 'Dark grey']",Clothing
https://www.pullandbear.com/ae/stwd-painted-denim-bermuda-shorts-l07698506,219.00,696091754,"Baggy denim Bermuda shorts with STWD logo on the back, a five-pocket design, belt loops and zipper fly and top button fastening.",['Grey'],Clothing
https://www.pullandbear.com/ae/baggy-jacquard-denim-bermuda-shorts-l07698535,219.00,692151917,"Baggy denim Bermuda shorts with a jacquard design, five-pocket design, belt loops, and zipper fly and top button fastening. Made of 100% cotton.Total look.",['Pale indigo'],Clothing
https://www.pullandbear.com/ae/baggy-denim-bermuda-shorts-l03694505,189.00,692152431,"Baggy denim Bermuda shorts with a five-pocket design, waistband with belt loops, zip fly and top button fastening. Made of cotton.","['Pale indigo', 'Medium blue', 'Navy', 'Faded navy', 'Dark grey', 'Faded black']",Clothing
https://www.pullandbear.com/ae/jacquard-denim-bermuda-shorts-l07698502,219.00,692157115,"Bermuda jorts with a jacquard design, pockets, belt loops and zip and button fastening. Made of 100% cotton.","['Pale blue', 'Pale grey']",Clothing
https://www.pullandbear.com/ae/loose-baggy-denim-bermuda-shorts-l03687516,189.00,692151512,"Loose baggy denim Bermuda shorts with belt loops, a five-pocket design and zip fly and top button fastening.","['Medium blue', 'White', 'Dark grey', 'Black', 'Dark blue']",Clothing
https://www.pullandbear.com/ae/skater-jorts-l03697505,189.00,692151517,"Skater jorts with belt loops, a five-pocket design and zip fly and top button fastening.","['Pale indigo', 'Faded violet', 'Medium blue', 'Faded black', 'Neon blue']",Clothing
https://www.pullandbear.com/ae/super-baggy-stwd-jorts-l03698501,119.00,692151526,"WAIST: Low riseFABRIC: Not stretchySuper baggy low-rise denim Bermuda jorts with a five-pocket design, belt loops and zip fly and top button fastening. Made of 100% cotton.","['Medium blue', 'Faded black', 'Neon blue']",Clothing
https://www.pullandbear.com/ae/mesh-bermuda-shorts-l07696504,149.00,692157175,Tracksuit Bermuda short with an elastic waistband and back pocket. Made of mesh fabric.Total look.,"['Sand', 'Black', 'Anthracite grey']",Clothing
https://www.pullandbear.com/ae/black-skater-bermuda-shorts-l07698543,219.00,695245049,"Skater-fit Bermuda shorts in black with white contrast stitching, a five-pocket design, belt loops, and a zipper fly and top button fastening.",['Navy'],Clothing
https://www.pullandbear.com/ae/pique-jogger-bermuda-shorts-l07693531,129.00,692157188,Piqué jogger Bermuda shorts with an elastic waistband. Made of cotton.,"['Mint', 'Black', 'Grey marl']",Clothing
https://www.pullandbear.com/ae/baggy-denim-bermuda-shorts-l07698525,189.00,692151596,"Baggy fit denim Bermuda shorts with a striped design, elasticated waist and pockets.Total look",['Pale indigo'],Clothing
https://www.pullandbear.com/ae/jacquard-denim-bermuda-shorts-l07698500,219.00,692157236,Jacquard denim Bermuda shorts featuring an elasticated waistband with contrast drawstrings and pockets.Total look,['Medium blue'],Clothing
https://www.pullandbear.com/ae/flecked-denim-skater-bermuda-shorts-l07687525,219.00,692152135,"Denim skater Bermuda shorts with a flecked print, a five-pocket design, belt loops and zip and button fastening. Made of 100% cotton.",['Medium blue'],Clothing
https://www.pullandbear.com/ae/faded-denim-skater-bermuda-shorts-l07698515,269.00,692152184,"Faded skater denim Bermuda shorts with a five-pocket design, belt loops, and zipper fly and top button fastening. Made of 100% cotton.",['Pale indigo'],Clothing
https://www.pullandbear.com/ae/braulio-amado-denim-skater-bermuda-shorts-l07698555,349.00,692151675,"Bráulio Amado license skater denim Bermuda shorts in jacquard fabric with geometric designs. Featuring a five-pocket design, belt loops and zip and button fastening. Made of 100% cotton.Total look.",['Medium blue'],Clothing
https://www.pullandbear.com/ae/check-skater-denim-bermuda-shorts-l07698545,219.00,692161430,"Denim skater Bermuda shorts with a check print, five-pocket design, belt loops and zip and button fastening. Made of 100% cotton.",['Khaki'],Clothing
https://www.pullandbear.com/ae/textured-baggy-denim-bermuda-shorts-l07698536,219.00,692152222,"Textured baggy denim Bermuda shorts with a five-pocket design, belt loops and zip and button fastening. Made of 100% cotton.Total look.",['Off white'],Clothing
https://www.pullandbear.com/ae/vertical-seam-bermuda-shorts-l07696514,219.00,714313640,"Khaki Bermuda shorts with contrasting vertical seams, a five-pocket design, belt loops and zipper fly and top button fastening. Made of cotton.",['Khaki'],Clothing
https://www.pullandbear.com/ae/stwd-skater-tracksuit-bermuda-shorts-l07696509,129.00,692151760,"Skater tracksuit jogger Bermuda shorts with STWD embroidery on the back, pockets and an elasticated waistband. Made of cotton.","['Anthracite grey', 'Off white', 'Mulberry']",Clothing
https://www.pullandbear.com/ae/linen-cargo-bermuda-shorts-l07696501,119.00,692156891,"Jogger Bermuda shorts made of viscose (78%) and linen (22%), with an elasticated waistband and drawstring fastening.","['Black', 'Green', 'Beige', 'Anthracite grey']",Clothing
https://www.pullandbear.com/ae/paintsplattered-loose-baggy-denim-bermuda-shorts-l07698565,219.00,707626469,"Loose baggy denim Bermuda shorts with paint-splatter detail, featuring a five-pocket design, belt loops and zipper fly and top button fastening.",['Ecru'],Clothing
https://www.pullandbear.com/ae/interlock-tracksuit-shorts-l07696505,149.00,692152297,Tracksuit jogger Bermuda shorts in interlock fabric with an elasticated drawstring waistband and pockets.Total look,"['Black', 'Grey marl', 'Off white', 'Anthracite grey']",Clothing
https://www.pullandbear.com/ae/jogging-bermuda-shorts-in-waffle-knit-fabric-l07696503,75.00,692161520,Waffle-knit tracksuit jogger Bermuda shorts with an elasticated waistband. Made of 100% cotton.,"['Off white', 'Grey marl', 'Anthracite grey']",Clothing
https://www.pullandbear.com/ae/floral-baggy-denim-bermuda-shorts-l07698538,219.00,692152309,"Baggy denim Bermuda shorts with a floral jacquard design, pockets, belt loops, and button and zip fastening.  Total look",['Pale indigo'],Clothing
https://www.pullandbear.com/ae/stwd-short-sleeve-sweatshirt-l03598506,75.00,692157440,Short sleeve sweatshirt with an embroidered STWD logo on the front and a round neck. Made of cotton.Total look,"['Mauve', 'Black', 'Grey', 'Sand', 'Khaki']",Clothing
https://www.pullandbear.com/ae/braulio-amado-zipup-hoodie-l07151583,269.00,694880387,"Bráulio Amado license hoodie with zip fastening, a daisy graphic on the front, long sleeves and a pouch pocket.",['Mauve'],Clothing
https://www.pullandbear.com/ae/boxy-hoodie-with-zipper-l07560512,199.00,692151443,Boxy long sleeve hoodie with zipper fastening and side pockets.,"['Black', 'Pale marl']",Clothing
https://www.pullandbear.com/ae/boxy-hooded-sweatshirt-l07560508,189.00,692161572,"Boxy fit, long sleeve hoodie available in several colours, with a hood, front pouch pocket and made of a cotton blend.","['Black', 'Pale marl']",Clothing
https://www.pullandbear.com/ae/boxy-faded-sweatshirt-l07560511,149.00,697861799,Boxy faded sweatshirt with a round neck and long sleeves.,"['Anthracite grey', 'Grey']",Clothing
https://www.pullandbear.com/ae/washed-boxy-zipup-hoodie-l07560515,199.00,692151489,"Washed boxy hoodie with long sleeves, a hood, zip fastening and side pockets.",['Grey'],Clothing
https://www.pullandbear.com/ae/basic-boxy-sweatshirt-l07560510,149.00,692161736,Boxy sweatshirt with a round neck and long sleeves.,"['Ecru', 'Black']",Clothing
https://www.pullandbear.com/ae/primavera-sound-x-pb-hoodie-l07012505,269.00,697494991,Cotton hoodie from the Primavera Sound x PB collection.,['Brown'],Clothing
https://www.pullandbear.com/ae/stwd-hoodie-l07560503,219.00,692161492,"Hoodie available in various colours, with a contrasting embroidered STWD logo, a front pouch pocket and made from a cotton blend.","['Off white', 'Mauve', 'Green', 'Black', 'Ice']",Clothing
https://www.pullandbear.com/ae/stwd-hoodie-l07560519,199.00,695878868,"Hoodie available in several colours, with contrasting STWD graphic, front pouch pocket and made of a cotton blend.","['Grey marl', 'Deep blue']",Clothing
https://www.pullandbear.com/ae/stwd-hoodie-l07590505,219.00,695435493,Long sleeve hoodie with STWD embroidery.Total look.,"['Black', 'Off white', 'Pink', 'Green', 'Pastel pink']",Clothing
https://www.pullandbear.com/ae/boxy-hoodie-l07560509,189.00,715754987,Boxy hoodie with a washed finish and a front pouch pocket. Made of cotton.,['Grey'],Clothing
https://www.pullandbear.com/ae/braulio-amado-striped-short-sleeve-shirt-l07472556,219.00,695902210,"Bráulio Amado license short sleeve shirt with a striped design, button fastening, Kent collar and graphic on the front. Made of 100% cotton.",['Blue'],Clothing
https://www.pullandbear.com/ae/long-sleeve-shirt-l07472902,199.00,701515283,Basic long sleeve shirt with button fastening.,"['Off white', 'Blue', 'Pink']",Clothing
https://www.pullandbear.com/ae/floral-graphic-bowling-shirt-l07472504,219.00,692156951,"Short sleeve bowling shirt with a floral graphic on the back and contrast 'Botanical Seed' embroidery on the front with button fastening, pocket and contrast neck.",['Off white'],Clothing
https://www.pullandbear.com/ae/textured-striped-short-sleeve-shirt-l07472503,119.00,692156957,"Short sleeve shirt in textured fabric with a striped design, a Kent collar and a button-up front. Made of cotton.Total look.",['Sand'],Clothing
https://www.pullandbear.com/ae/henri-matisse-overshirt-l07701505,299.00,692151843,"Henri Matisse licensed blue overshirt with embroidery inspired by the painting ""Fleurs De Neige"", with front pockets, button fastening, lapel collar and long sleeves.Pull&Bear Shapes of Summer collection inspired by Henri Matisse.",['Blue'],Clothing
https://www.pullandbear.com/ae/short-sleeve-check-stwd-shirt-l07472956,189.00,692156976,"Boxy fit shirt with short sleeves, a check design, an embroidered STWD logo on the front and button fastening. Made of a cotton blend.","['Blue', 'Anthracite grey']",Clothing
https://www.pullandbear.com/ae/short-sleeve-flowing-shirt-l07472527,219.00,692764727,"Flowing short sleeve shirt with a button-up front, a lapel collar and front pocket detail.","['Black', 'Blue', 'Off white']",Clothing
https://www.pullandbear.com/ae/short-sleeve-rustic-shirt-l07472505,189.00,692157005,Rustic short sleeve crepe shirt with a Kent collar and button fastening. Made of cotton.,"['Black', 'Off white', 'Ochre']",Clothing
https://www.pullandbear.com/ae/black-openwork-short-sleeve-shirt-l07472521,219.00,692152403,"Black short sleeve shirt with openwork detail, a lapel collar and button fastening. Made of a cotton blend.",['Black'],Clothing
https://www.pullandbear.com/ae/cutwork-short-sleeve-shirt-l07472520,219.00,692152405,Short sleeve shirt in cutwork knit fabric with a lapel collar and button fastening. Made of cotton.,['Sand'],Clothing
https://www.pullandbear.com/ae/shirt-with-embroidered-flowers-l07472517,219.00,692152412,Short sleeve shirt with floral embroidery and button fastening. Made of cotton (88%) and linen (12%).,"['Off white', 'Black']",Clothing
https://www.pullandbear.com/ae/short-sleeve-shirt-l07472519,219.00,692152413,Short sleeve shirt with a Kent collar and button fastening.,['Off white'],Clothing
https://www.pullandbear.com/ae/linen-blend-short-sleeve-shirt-l07472591,169.00,700808293,Short sleeve collared shirt with a button-up front. Made of a linen (55%) and cotton (45%) blend.Total look.,"['Off white', 'Beige', 'Blue', 'Mint', 'Anthracite grey', 'Ochre']",Clothing
https://www.pullandbear.com/ae/textured-black-short-sleeve-shirt-l07472506,219.00,692157035,Black short sleeve shirt in textured fabric with a Kent collar and a button-up front. Made of a cotton blend.,['Black'],Clothing
https://www.pullandbear.com/ae/jacquard-denim-shirt-l07474502,269.00,692151919,"Short sleeve denim shirt with a jacquard design, lapel collar, zipper fastening and front pocket detail. Made of 100% cotton.Total look.",['Pale indigo'],Clothing
https://www.pullandbear.com/ae/short-sleeve-shirt-with-asymmetrical-stripes-l07472525,219.00,697465468,"Short sleeve shirt with an asymmetric stripe design, a shirt collar, button fastening and a slogan graphic on the front. Made of 100% cotton.","['Blue', 'Ochre']",Clothing
https://www.pullandbear.com/ae/short-sleeve-poplin-shirt-l07472952,189.00,692157568,Basic boxy fit poplin shirt with a button-up front and short sleeves.,"['Off white', 'Black']",Clothing
https://www.pullandbear.com/ae/short-sleeve-striped-stwd-shirt-l07472950,189.00,692157570,"Short sleeve boxy fit shirt with a striped design, button-up front and STWD embroidery on the front.",['Pale blue'],Clothing
https://www.pullandbear.com/ae/short-sleeve-striped-stwd-shirt-l07472951,189.00,692157571,"Short sleeve boxy fit shirt with a striped design, button-up front and STWD embroidery on the front.",['Striped'],Clothing
https://www.pullandbear.com/ae/short-sleeve-striped-shirt-l07472955,189.00,692161158,Short sleeve shirt with a striped print and a button-up front.,"['Blue', 'Green']",Clothing
https://www.pullandbear.com/ae/short-sleeve-striped-stwd-shirt-l07472515,219.00,692161694,"Short sleeve shirt with a striped design, STWD embroidery on the front, a Kent collar and button fastening.","['Blue', 'Off white']",Clothing
https://www.pullandbear.com/ae/linen-blend-short-sleeve-shirt-l03474527,199.00,701517485,"Rustic boxy fit shirt with short sleeves, a Kent collar and a button-up front. Made of a cotton and linen blend.",['Ecru'],Clothing
https://www.pullandbear.com/ae/rustic-striped-shirt-l03474525,199.00,701517492,Striped short sleeve shirt with a front pocket and button fastening. Made of 100% cotton rustic fabric.,['Striped'],Clothing
https://www.pullandbear.com/ae/rustic-striped-short-sleeve-shirt-l07472526,119.00,696254662,"Rustic short sleeve shirt with a striped design, button-up front and lapel collar. Made of a cotton (88%) and linen (12%) blend.",['Sand'],Clothing
https://www.pullandbear.com/ae/short-sleeve-rustic-shirt-l03474523,189.00,699518184,Rustic collared shirt with short sleeves and a button-up front.Total look.,"['Off white', 'Black']",Clothing
https://www.pullandbear.com/ae/short-sleeve-rustic-shirt-l07472509,219.00,692161265,"Rustic short sleeve shirt with contrast button fastening, topstitching and a front pocket.",['Off white'],Clothing
https://www.pullandbear.com/ae/short-sleeve-crochet-shirt-l07472510,219.00,692161312,Short sleeve shirt with a Kent collar and button-up front. Made of cotton.,['Off white'],Clothing
https://www.pullandbear.com/ae/short-sleeve-print-shirt-l07472542,119.00,697299753,Short sleeve shirt with a lapel collar and button fastening. Made of cotton.,['Sand'],Clothing
https://www.pullandbear.com/ae/blue-short-sleeve-shirt-with-print-l07472541,219.00,697299754,Blue short sleeve shirt with a lapel collar and button fastening. Made of cotton.,['Blue'],Clothing
https://www.pullandbear.com/ae/pink-short-sleeve-shirt-with-print-l07472540,219.00,697299756,Short sleeve pink shirt with a lapel collar and button fastening. Made of cotton.,['Rose pink'],Clothing
https://www.pullandbear.com/ae/short-sleeve-shirt-with-slogan-l07472543,219.00,697299758,Short sleeve shirt with a contrast slogan on the front and button-up front. Made from cotton.,['Off white'],Clothing
https://www.pullandbear.com/ae/short-sleeve-denim-shirt-l07474501,189.00,692151603,"Short sleeve denim shirt with a striped design, front pocket and button fastening.Total look",['Pale indigo'],Clothing
https://www.pullandbear.com/ae/short-sleeve-printed-crepe-shirt-l03474714,189.00,699865409,"Short sleeve crepe shirt with a leaf print, a Kent collar and a button-up front. Made of cotton.",['Off white'],Clothing
https://www.pullandbear.com/ae/short-sleeve-crepe-shirt-l03474715,189.00,699865410,Short sleeve crepe shirt with a Kent collar and button-up front. Made of cotton.,['Off white'],Clothing
https://www.pullandbear.com/ae/chiffon-short-sleeve-shirt-l07472511,219.00,692161346,"Short sleeve shirt in a chiffon-style fabric with front pockets, button fastening, lapel collar and made of cotton.",['Dark grey'],Clothing
https://www.pullandbear.com/ae/short-sleeve-shirt-l07472957,219.00,692157252,Short sleeve shirt with a Kent collar and button-up front. Made of a cotton blend.,['Ochre'],Clothing
https://www.pullandbear.com/ae/short-sleeve-striped-jacquard-shirt-l07474500,219.00,692157250,"Short sleeve shirt in jacquard fabric with a striped design, front pocket and button-up front. Made of cotton.",['Medium blue'],Clothing
https://www.pullandbear.com/ae/rustic-matisse-shirt-l07472528,269.00,692152163,"Matisse license short sleeve shirt with a contrast graphic and slogan, front pockets and a button-up front. Made of a cotton (72%) and linen (28%) blend.",['Blue'],Clothing
https://www.pullandbear.com/ae/rustic-striped-short-sleeve-shirt-l03474550,199.00,692161381,"Rustic short sleeve shirt with a striped design, Kent collar, button fastening and front pocket detail. Made of 100% cotton.",['Striped'],Clothing
https://www.pullandbear.com/ae/striped-rustic-shirt-l07472500,199.00,692157312,"Rustic short sleeve shirt with a striped design, button fastening, lapel collar and made of 100% cotton fabric.",['Striped'],Clothing
https://www.pullandbear.com/ae/striped-short-sleeve-shirt-l07472513,219.00,692161437,"Short sleeve boxy fit shirt with a Kent collar, button fastening, a striped design and a blue terrace graphic on the back. Made of 100% cotton.",['Striped'],Clothing
https://www.pullandbear.com/ae/short-sleeve-waffleknit-shirt-l07472512,219.00,692161449,"Short sleeve shirt with a Kent collar, button fastening and a striped design.",['Red'],Clothing
https://www.pullandbear.com/ae/check-short-sleeve-shirt-l07472516,219.00,692151722,"Short sleeve shirt with a check design, Kent collar and button fastening. Made of 100% cotton.",['Off white'],Clothing
https://www.pullandbear.com/ae/short-sleeve-shirt-with-washed-finish-l07472518,119.00,692152236,"Short sleeve shirt with a washed finish, front pockets and button fastening.",['Brown'],Clothing
https://www.pullandbear.com/ae/floral-jacquard-short-sleeve-shirt-l07472524,219.00,698445235,"Short sleeve shirt with a floral jacquard design, a lapel collar and a button-up front. Made of a cotton blend.",['Off white'],Clothing
https://www.pullandbear.com/ae/textured-short-sleeve-shirt-l07474503,219.00,692152258,"Textured short sleeve shirt with a Kent collar, button fastening and a front pocket. Made of 100% cotton.Total look.",['Off white'],Clothing
https://www.pullandbear.com/ae/short-sleeve-shirt-with-embroidered-slogan-l07472523,119.00,697495005,"Short sleeve shirt with a contrast ""Never Ever"" embroidered slogan, a lapel collar and a button-up front. Made of 100% cotton.",['Off white'],Clothing
https://www.pullandbear.com/ae/short-sleeve-floral-denim-shirt-l07474504,269.00,692152287,"Short sleeve denim shirt with a floral jacquard design, button fastening, front pocket and made of cotton.",['Pale indigo'],Clothing
https://www.pullandbear.com/ae/100-linen-boxy-fit-shirt-l03474503,269.00,701515234,Short sleeve shirt with a button-up front and a front pocket. Made of 100% linen.Total look.,"['Beige', 'Off white', 'Navy']",Clothing
https://www.pullandbear.com/ae/puffer-jacket-with-hood-l07700536,269.00,692151747,"Puffer jacket with a hood, zipper fastening and long sleeves.","['Sand', 'Chocolate', 'Black', 'Anthracite grey', 'Green']",Clothing
https://www.pullandbear.com/ae/stwd-pouch-pocket-jacket-l07700525,219.00,692151879,"Jacket with a pouch pocket, contrast STWD logo, hood and zipper fastening on the chest.","['Off white', 'Black', 'Chocolate', 'Dark grey']",Clothing
https://www.pullandbear.com/ae/stwd-puffer-vest-l07801501,219.00,692151468,"STWD puffer vest with zipper fastening, high neck and pockets.","['Grey', 'Sand', 'Black']",Clothing
https://www.pullandbear.com/ae/lightweight-stwd-raincoat-l07700502,219.00,692151471,"Lightweight raincoat with a hood, featuring a contrast embroidered STWD logo, zip fastening, and elasticated cuffs and hem.","['Anthracite grey', 'Black']",Clothing
https://www.pullandbear.com/ae/faux-suede-trucker-jacket-l07700509,269.00,692161211,"Faux suede trucker jacket with side pockets, zipper fastening and ribbed trims.","['Brown', 'Black']",Clothing
https://www.pullandbear.com/ae/velvet-jacket-l07701507,299.00,693161401,"Velvet-effect fabric jacket with pockets, a lapel collar, and button fastening. Made of 100% cotton.",['Yellow'],Clothing
https://www.pullandbear.com/ae/stwd-puffer-jacket-l07700537,269.00,692151739,"Puffer jacket with a high neck, STWD embroidery on the front, zipper fastening and long sleeves.","['Sand', 'Anthracite grey', 'Navy', 'Black', 'Grey']",Clothing
https://www.pullandbear.com/ae/short-sleeve-knit-polo-shirt-l07550521,189.00,701515240,Short sleeve knit polo shirt with a Kent collar. Made of a cotton blend.,['Black'],Clothing
https://www.pullandbear.com/ae/pack-of-2-basic-swimming-trunks-l03805903,175.00,692152064,Pack of two basic swimming trunks with an embroidered logo and an elastic drawstring waistband.,"['Green/Grey', 'Others', 'Black tone']",Clothing
https://www.pullandbear.com/ae/stwd-swim-shorts-l03805501,99.00,701982209,Basic swim shorts with an embroidered logo and an elasticated drawstring waistband. Available in assorted colours.,"['Black', 'Deep blue', 'Navy', 'Red', 'Green']",Clothing
https://www.pullandbear.com/ae/stwd-board-shorts-with-side-stripes-l07600501,129.00,692157195,"Board shorts with a contrast STWD graphic on the side, an elastic waistband with contrast drawstrings and pockets.","['Black', 'Purple']",Clothing
