pdp_url,prices,product_id,product_description,color,product_type
https://www.pullandbear.com/ae/playstation-x-stwd-color-block-jacket-l07701511,299.00,698626048,"PlayStation licensed jacket with a color block design, a zipper fastening, a high neck and elastic cuffs and hem.Total look",['Grey'],Clothing
https://www.pullandbear.com/ae/textured-jacket-l07700539,219.00,715722758,"Long sleeve jacket with snap button fastening, a shirt collar and side pockets.","['Black', 'Ecru']",Clothing
https://www.pullandbear.com/ae/baggy-cargo-pants-l07674504,189.00,715722759,"Baggy fit cargo pants with pockets, belt loops, and zipper fly and top button fastening.","['Anthracite grey', 'Brown', 'Black', 'Ice']",Clothing
https://www.pullandbear.com/ae/stwd-soccer-tshirt-l07152930,189.00,702863368,STWD soccer T-shirt with a ribbed collar and short sleeves.,['Black'],Clothing
https://www.pullandbear.com/ae/printed-baggy-joggers-l07675509,169.00,715722761,"Printed baggy tracksuit-style joggers, with pockets, an elasticated drawstring waistband, and made of a cotton blend.",['Dark grey'],Clothing
https://www.pullandbear.com/ae/baggy-jeans-l07683508,219.00,715722762,"Baggy jeans with a five-pocket design, belt loops, a zipper fly and top button fastening. Made of 100% cotton.","['Ecru', 'Medium blue', 'Pale indigo', 'Pale grey', 'Dark grey', 'Salmon', 'Lavender blue', 'Pale blue', 'Faded black', 'Greenish blue']",Clothing
https://www.pullandbear.com/ae/stwd-soccer-tshirt-l07152931,189.00,702863369,STWD soccer T-shirt with a ribbed collar and short sleeves with 'STWD Goods' text.,['Medium ecru'],Clothing
https://www.pullandbear.com/ae/round-neck-sweater-l07550509,169.00,715722764,"Ribbed knit sweater with long sleeves and a round neck, featuring a mock t-shirt collar.","['Off white', 'Black', 'Grey marl', 'Dark green']",Clothing
https://www.pullandbear.com/ae/pack-of-2-bracelets-l07902512,75.00,701042783,Pack of 2 metallic chain and bangle bracelets.,['Others'],Clothing
https://www.pullandbear.com/ae/basic-round-neck-sweatshirt-l07560514,129.00,711647332,Basic round neck sweatshirt available in various colours and made of a cotton blend.,"['Off white', 'Grey blue', 'Black', 'Grey marl', 'Ice']",Clothing
https://www.pullandbear.com/ae/fabric-stwd-backpack-l15090640,189.00,711647334,Fabric backpack available in various colours. STWD logo detail. Front pocket. Interior with a large compartment for organisation. Short carry handle and adjustable shoulder straps. Zip closure.Height x Width x Depth: 42 x 30 x 13 cm.,"['Grey', 'Khaki']",Clothing
https://www.pullandbear.com/ae/skater-jeans-l07683519,219.00,702191720,"Skater jeans with a five-pocket design, belt loops, zipper fly and top button fastening, and made from 100% cotton.","['Pale blue', 'Medium blue', 'Navy', 'Faded black', 'Black', 'Neon blue']",Clothing
https://www.pullandbear.com/ae/stwd-soccer-tshirt-l07152539,189.00,711475305,"STWD soccer T-shirt with a striped design, 'Puerto Rico' text, ribbed V-neck and short sleeve.",['Striped'],Clothing
https://www.pullandbear.com/ae/stwd-checked-soccer-tshirt-l07152929,189.00,713556104,STWD soccer T-shirt with a checked print and short sleeves.,['White'],Clothing
https://www.pullandbear.com/ae/ombre-skater-denim-bermuda-shorts-l03683569,269.00,705642633,"Denim skater Bermuda shorts with a five-pocket design, belt loops, zip and button fastening, an ombré print and trim details. Made of 100% cotton.",['Grey'],Clothing
https://www.pullandbear.com/ae/stwd-embroidered-hoodie-l07560504,219.00,711647404,"Hoodie with an STWD front embroidery, a pouch pocket and long sleeves.","['Off white', 'Black', 'Blue', 'Navy', 'Bottle', 'Burgundy', 'Grey marl']",Clothing
https://www.pullandbear.com/ae/quilted-bomber-jacket-l07700503,219.00,714313902,"Quilted bomber jacket with zipper fastening, pockets and long sleeves.","['Navy', 'Black', 'Off white']",Clothing
https://www.pullandbear.com/ae/stwd-washed-hoodie-l07560517,269.00,711647406,"Hoodie available in various shades with a faded finish, with a contrast STWD embroidered logo, front pouch pocket and made from a cotton blend.","['Black', 'Brown', 'Grey', 'Ecru']",Clothing
https://www.pullandbear.com/ae/graphic-slogan-sweater-l07550518,269.00,695244982,"Long sleeve, round neck sweater with a graphic slogan on the front. Made of 100% cotton.","['Blue', 'Black', 'Off white', 'Red']",Clothing
https://www.pullandbear.com/ae/skater-sneakers-l12225640,219.00,714313950,Skater-style sneakers available in several colors. Multi-piece details on the upper. Lace-up fastening.OrthoLite® inner insoleSole height: 3.5 cm.,"['Ecru', 'Charcoal']",Footwear
https://www.pullandbear.com/ae/stwd-striped-shirt-l07472557,189.00,698994915,"Boxy-fit short sleeve shirt with a striped design, button-up front, STWD embroidery on the front and made of a cotton blend.","['Striped', 'Dark blue']",Clothing
https://www.pullandbear.com/ae/mickey-mouse-football-sweatshirt-l07650517,219.00,703074544,"Dual licensed Mickey Mouse football style sweatshirt, with long sleeves, a V-neck, and a graphic on the front and back.",['Navy'],Clothing
https://www.pullandbear.com/ae/basic-hoodie-l07560513,169.00,711647474,"Basic hoodie available in assorted colours, with a front pouch pocket and made of a cotton blend.","['Grey blue', 'Sky blue', 'Brown', 'Bottle', 'Off white', 'Pink', 'Grey marl', 'Navy', 'Dark mulberry', 'Ecru', 'Anthracite grey', 'Ice', 'Black']",Clothing
https://www.pullandbear.com/ae/washed-denim-jacket-l07700548,299.00,714314049,"Long sleeve denim jacket with a washed finish, front pockets, zip fastening and made of 100% cotton.",['Neon blue'],Clothing
https://www.pullandbear.com/ae/camouflage-print-jacket-l07701504,349.00,714314051,"Cotton jacket with a camouflage print, with pockets, a shirt collar and zip fastening.Total look",['White/Green'],Clothing
https://www.pullandbear.com/ae/camouflage-print-carpenter-jeans-l07674512,299.00,714314052,"Carpenter wide-leg jeans with a camouflage print, a five-pocket design, belt loops, and a zipper fly and top button fastening. Made of 100% cotton.Total look",['White/Green'],Clothing
https://www.pullandbear.com/ae/stwd-patch-hoodie-l07560520,269.00,714314054,"Long sleeve hoodie with an embroidered STWD logo on the front, an STWD patch on the back, and a pouch pocket.","['Off white', 'Brown', 'Grey', 'Beige']",Clothing
https://www.pullandbear.com/ae/oklahoma-graphic-tshirt-l07150500,99.00,714314055,"White short sleeve T-shirt with a contrasting graphic on the front and back, with a round neck and made from cotton.",['Off white'],Clothing
https://www.pullandbear.com/ae/technical-playstation-x-stwd-tshirt-l07152533,189.00,699865418,"PlayStation licensed T-shirt in technical fabric, with a contrasting graphic, short sleeves and a round neck.",['Grey'],Clothing
https://www.pullandbear.com/ae/short-sleeve-sweatshirt-with-patch-l07150502,149.00,714314064,"Short sleeve sweatshirt with a patch and embroidered slogan on the front and a graphic on the back, with a crew neck and made of a cotton blend.",['Anthracite grey'],Clothing
https://www.pullandbear.com/ae/playstation-x-stwd-polo-shirt-l07152934,199.00,699865426,Short sleeve PlayStation licensed polo shirt with a contrast graphic and a panelled design.,['Black'],Clothing
https://www.pullandbear.com/ae/playstation-x-stwd-football-tshirt-l07152534,199.00,699865433,"Football-style PlayStation licensed T-shirt, short sleeve, with a contrast graphic and a panelled design.",['Grey'],Clothing
https://www.pullandbear.com/ae/long-sleeve-tshirt-with-seams-l07151513,129.00,714314075,Oversize long sleeve T-shirt with a round neck and made of cotton.,"['Grey', 'Off white', 'Black']",Clothing
https://www.pullandbear.com/ae/faded-wideleg-jeans-l07687505,269.00,714314081,"Wide-leg jeans with a faded finish, five-pocket design, belt loops, and zipper fly and top button fastening. Made of 100% cotton fabric.",['Neon blue'],Clothing
https://www.pullandbear.com/ae/car-graphic-tshirt-l07151565,129.00,714314084,"Short sleeve T-shirt with a car graphic and contrast slogan, a round neck, and made of cotton.",['Off white'],Clothing
https://www.pullandbear.com/ae/striped-tshirt-l07151566,129.00,714314085,Short sleeve T-shirt with a horizontal striped design and round neck. Made of cotton.,['Maroon'],Clothing
https://www.pullandbear.com/ae/stwd-embroidered-logo-hoodie-l07560518,269.00,714314091,"Long sleeve hoodie with an embroidered STWD logo on the front and back, and a pouch pocket.","['Black', 'Off white', 'Grey marl', 'Burgundy']",Clothing
https://www.pullandbear.com/ae/waffleknit-sweater-l07550508,189.00,714314102,"Knit sweater in waffle-knit fabric, with a round neck and ribbed trim.","['Grey marl', 'Chocolate', 'Off white', 'Ochre', 'Black']",Clothing
https://www.pullandbear.com/ae/denim-shirt-l07474505,219.00,695060880,"Long sleeve denim shirt with a Kent collar, button fastening and a front pocket. Made from 100% cotton fabric.","['Neon blue', 'Medium blue']",Clothing
https://www.pullandbear.com/ae/stwd-striped-patch-shirt-l07472559,219.00,711647642,"Short sleeve boxy-fit shirt with a striped design, button fastening, and an STWD Studio patch on the front. Made of a blend of cotton (48%) and linen (52%).",['Blue'],Clothing
https://www.pullandbear.com/ae/stwd-polo-shirt-l07550531,189.00,711647643,"STWD short sleeve polo shirt with embroidered detailing, a front stripe and a contrast ribbed collar.",['Off white'],Clothing
https://www.pullandbear.com/ae/stwd-checked-tshirt-l07151553,149.00,711647644,"Long sleeve checked T-shirt in orange with a washed effect, STWD embroidery, and a ribbed round neck.",['Copper'],Clothing
https://www.pullandbear.com/ae/stretch-belt-l07950504,75.00,711647646,Black stretch belt with a metallic-finish square buckle.,['Black'],Clothing
https://www.pullandbear.com/ae/stwd-panelled-shirt-l07472544,219.00,711647657,"Short sleeve shirt with a vertical panel design, STWD embroidery on the front and button fastening.",['Red'],Clothing
https://www.pullandbear.com/ae/mickey-mouse-polo-shirt-l07152551,169.00,714314177,"Mickey Mouse license polo shirt, short sleeve, with a V-neckline and Kent collar, and a Mickey Mouse graphic on the front and back. Made from 100% cotton.",['Off white'],Clothing
https://www.pullandbear.com/ae/white-tshirt-with-gloria-silva-photographic-print-l07151542,119.00,714314185,White short sleeve T-shirt with a contrasting Gloria Silva photographic print and a round neck. Made from a cotton blend.,['White'],Clothing
https://www.pullandbear.com/ae/faux-leather-jacket-l07700513,299.00,714314404,"Faux leather jacket with long sleeves, a Kent collar, zipper fastening, and pockets.",['Dark brown'],Clothing
https://www.pullandbear.com/ae/pack-of-3-rings-l07901501,99.00,697465507,Pack of three metallic silver-colored rings.,['Others'],Clothing
https://www.pullandbear.com/ae/embroidered-varsity-bomber-jacket-l07700527,299.00,692151475,"Varsity-style bomber jacket with contrasting patches and embroidery, featuring side pockets, ribbed trims and snap button fastening.","['Bottle', 'Black']",Clothing
https://www.pullandbear.com/ae/washed-patch-shirt-l07472533,219.00,714314432,"Short sleeve shirt with 'Creative Manner' front embroidery, a star patch on the back, and button fastening.","['Pale blue', 'Anthracite grey']",Clothing
https://www.pullandbear.com/ae/playstation-x-stwd-cap-l07930539,99.00,703746756,"PlayStation license cap with an embroidered logo on the front panel, curved peak and adjustable fastening at the back.",['Grey'],Clothing
https://www.pullandbear.com/ae/multipanel-trainers-l12302640,269.00,714314446,Trainers available in several colours. Combination of materials and metallic details on the upper. Chunky sole. Lace-up fastening.OrthoLite® insoleSole height: 5.5 cm.,"['Ecru', 'Black']",Footwear
https://www.pullandbear.com/ae/short-sleeve-check-shirt-l07472558,219.00,705096506,"Short sleeve shirt with a check design, Kent collar, button-up front and made of cotton.",['Grey'],Clothing
https://www.pullandbear.com/ae/stwd-soccer-tshirt-l07152928,189.00,703959868,STWD soccer T-shirt with a contrast ribbed collar and short sleeves.,['Blue'],Clothing
https://www.pullandbear.com/ae/tshirt-with-gloria-silva-photo-l07151540,119.00,692757367,Short sleeve T-shirt with a round neck and a contrast photo print by Gloria Silva. Made from a cotton blend.,['Grey'],Clothing
https://www.pullandbear.com/ae/gloria-silva-photo-tshirt-l07151543,119.00,692757373,"Round neck, short sleeve T-shirt featuring a Gloria Silva photo print at the back and contrast 'Seamless Design' text. Made of cotton blend.",['Sand'],Clothing
https://www.pullandbear.com/ae/black-tshirt-with-gloria-silva-photographic-print-l07151541,119.00,692757376,Black short sleeve T-shirt with a contrast Gloria Silva photographic print and a round neck. Made of a cotton blend.,['Black'],Clothing
https://www.pullandbear.com/ae/contrast-stitch-tshirt-l07151551,99.00,697267100,"Short sleeve T-shirt in various colours, featuring contrast stitching, a round neck, and an embroidered graphic label at the hem. Made of cotton.","['Anthracite grey', 'Mustard', 'Off white']",Clothing
https://www.pullandbear.com/ae/long-sleeve-striped-polo-shirt-l07550519,219.00,697267102,Long sleeve STWD striped knit polo shirt with button fastening at the collar.,"['Sky blue', 'Dark green']",Clothing
https://www.pullandbear.com/ae/stwd-embroidered-tshirt-l07151552,99.00,713407436,"STWD T-shirt with embroidery on the front, 'It's time' text on the back, a crew neck and short sleeves.",['Off white'],Clothing
https://www.pullandbear.com/ae/northern-sea-cap-l07930531,75.00,698993627,Two-tone cap with 'Northern Sea' embroidery and a red peak.,['Others'],Clothing
https://www.pullandbear.com/ae/no-place-like-home-cap-l07930529,75.00,698625026,"Cap with a contrast curved peak, embroidery on the front panel and adjustable back fastening.",['Others'],Clothing
https://www.pullandbear.com/ae/wideleg-jeans-l07683512,219.00,713407498,"Wide-leg jeans with a five-pocket design, belt loops, and zipper fly and top button fastening.","['Dark grey', 'Greenish blue', 'Faded black', 'Medium blue', 'Neon blue']",Clothing
https://www.pullandbear.com/ae/cotton-jacket-with-zipper-l07700521,219.00,692157459,"Lightweight cotton jacket with zipper fastening, pockets and long sleeves.","['Black', 'Pale grey']",Clothing
https://www.pullandbear.com/ae/mickey-mouse-hoodie-l07650516,219.00,703710244,"Mickey Mouse license sweatshirt with a hood, long sleeves, and a kangaroo pocket, with a graphic on the front and back.",['Grey marl'],Clothing
https://www.pullandbear.com/ae/short-sleeve-tshirt-with-graphic-and-slogan-l07151576,99.00,698625082,"Short sleeve T-shirt with a slogan on the front and a slogan graphic on the back, with a crew neck. Made of cotton.",['Maroon'],Clothing
https://www.pullandbear.com/ae/playstation-x-stwd-panelled-hoodie-l07160516,269.00,699722889,"PlayStation licensed hoodie with a panelled design, a contrast graphic on the front and back, a pouch pocket, and made from a cotton blend.",['Black'],Clothing
https://www.pullandbear.com/ae/panelled-playstation-x-stwd-tshirt-l07152530,219.00,699722891,"PlayStation licensed T-shirt with a multi-tone panel design, a contrast graphic, long sleeves and a round neck.",['Black'],Clothing
https://www.pullandbear.com/ae/2pack-of-beaded-necklaces-l07902510,99.00,700847260,Pack of 2 beaded necklaces featuring a spiral pendant.,['Others'],Clothing
https://www.pullandbear.com/ae/vest-graphic-tshirt-l07151574,99.00,716676259,"Short sleeve T-shirt with a vest graphic featuring an STWD logo on the straps, with a round neck and made of cotton.",['Off white'],Clothing
https://www.pullandbear.com/ae/frayed-zipup-hoodie-l07560527,269.00,716676260,"Hoodie with zip fastening, STWD embroidery on the front, a pouch pocket and frayed finishes.","['Off white', 'Anthracite grey']",Clothing
https://www.pullandbear.com/ae/acidwash-stwd-sweater-l07550515,219.00,716676261,"Knit sweater with a round neck, STWD logo on the front and ribbed trims.","['Faded black', 'Sand']",Clothing
https://www.pullandbear.com/ae/stwd-text-tshirt-l07151573,99.00,716676262,"Short sleeve T-shirt with a contrast graphic and STWD text on the front and back, with a round neck and made of cotton.",['Off white'],Clothing
https://www.pullandbear.com/ae/snoopy-mesh-tshirt-l07152921,189.00,716676269,"Boxy short sleeve Snoopy licence T-shirt, featuring a Peanuts graphic and a contrasting number 50, with a round neck and crafted from mesh fabric.",['Red'],Clothing
https://www.pullandbear.com/ae/snoopy-white-sweatshirt-l07151937,189.00,716676270,"Snoopy license white sweatshirt, featuring a contrast Peanuts graphic, a round neck and made of cotton.",['Off white'],Clothing
https://www.pullandbear.com/ae/snoopy-striped-polo-shirt-l07152923,169.00,716676271,"Snoopy license striped polo shirt with short sleeves, a contrast Peanuts graphic, and made of a cotton blend.",['Striped'],Clothing
https://www.pullandbear.com/ae/mickey-mouse-hoodie-l07160917,219.00,703079602,"Mickey Mouse license hoodie with a hood, a contrasting graphic and a kangaroo pocket.",['Off white'],Clothing
https://www.pullandbear.com/ae/mickey-mouse-short-sleeve-tshirt-l07152550,169.00,715295924,"Mickey Mouse license short sleeve T-shirt in a football style, with a number and Mickey Mouse graphic on the front, stripes on the sleeves, and made from 100% cotton.",['Navy'],Clothing
https://www.pullandbear.com/ae/relaxed-fit-baggy-jeans-l07683515,219.00,713555124,"Relaxed fit baggy jeans with a five-pocket design, belt loops and zipper fly and top button fastening.","['Pale indigo', 'Sand', 'Greenish blue', 'Lavender blue', 'Greenish', 'Black', 'Reddish', 'Navy']",Clothing
https://www.pullandbear.com/ae/mickey-mouse-blue-tshirt-l07152914,119.00,703079606,"Mickey Mouse license blue T-shirt with a contrast graphic, short sleeves, a round neck and made of cotton.",['Navy'],Clothing
https://www.pullandbear.com/ae/mickey-mouse-tshirt-l07152552,119.00,703079613,"Mickey Mouse license T-shirt, with short sleeves and a round neck, featuring a graphic on the front and back, made of 100% cotton.",['Off white'],Clothing
https://www.pullandbear.com/ae/baggy-cargo-jeans-l07687511,219.00,716676288,"Baggy cargo jeans with flap pockets on the leg, belt loops, zipper fly and top button fastening, and made from 100% cotton.","['Medium blue', 'Pale indigo', 'Dark grey', 'Faded black']",Clothing
https://www.pullandbear.com/ae/bell-bottom-jeans-l07687516,219.00,716676292,"Bell bottom jeans with a five-pocket design, belt loops, and a zipper fly and top button fastening. Made from cotton.","['Pale blue', 'Medium blue', 'Faded black']",Clothing
https://www.pullandbear.com/ae/stwd-boxy-tshirt-l07152529,129.00,699518151,"Boxy-fit T-shirt available in various colours with contrasting embroidered STWD logo, short sleeves and a round neck. Made of cotton.","['Black', 'Anthracite grey', 'Blue', 'White', 'Medium blue', 'Green']",Clothing
https://www.pullandbear.com/ae/baggy-cargo-trousers-l07674505,219.00,695878848,"Baggy cargo trousers with belt loops, zipper fly and top button fastening and pockets.","['Beige/Green', 'Brown', 'Black', 'Green']",Clothing
https://www.pullandbear.com/ae/stwd-91-hockey-tshirt-l07152511,149.00,697013457,"Boxy-fit short sleeve hockey T-shirt with a V-neck, a number 91 graphic on the front and made of cotton.",['Off white'],Clothing
https://www.pullandbear.com/ae/acid-wash-faded-knit-sweater-l07550510,219.00,716676318,Knit sweater with a round neck and ribbed trim.,"['Black', 'Bluish', 'Brown', 'Striped', 'Black marl']",Clothing
https://www.pullandbear.com/ae/striped-long-sleeve-shirt-l07472567,219.00,716676319,"Long sleeve shirt with a striped design, button-up front and made of 100% cotton.","['Sky blue', 'Off white']",Clothing
https://www.pullandbear.com/ae/quarterzip-sweater-l07550511,219.00,716676320,Knit sweater with a quarter-zip and long sleeves.,"['Grey marl', 'Black', 'Off white', 'Brown']",Clothing
https://www.pullandbear.com/ae/short-raglan-sleeve-tshirt-l07151575,99.00,699323629,Short raglan sleeve T-shirt with a round neck. Made of cotton.,"['Khaki', 'Navy']",Clothing
https://www.pullandbear.com/ae/acid-wash-cardigan-l07550534,269.00,699323632,"Long sleeve cardigan with a V-neck, ribbed cuffs and hem, button fastening, and made of 100% cotton.",['Khaki marl'],Clothing
https://www.pullandbear.com/ae/cropped-zipup-hoodie-l07560528,199.00,699323634,"Cropped hoodie with a hood and zipper fastening, featuring a pouch pocket and made from a cotton blend.",['Sand marl'],Clothing
https://www.pullandbear.com/ae/brown-faux-suede-belt-l07950510,75.00,695434567,Brown faux suede belt with a square metallic buckle.,['Brown'],Clothing
https://www.pullandbear.com/ae/acid-wash-faded-sweater-l07550514,189.00,692151638,Long sleeve sweater with a round neck. Made of cotton.,"['Brown', 'Faded black']",Clothing
https://www.pullandbear.com/ae/stwd-80-hockey-tshirt-l07151579,149.00,695434620,"Boxy-fit hockey T-shirt with short sleeves, a V-neck and an 80 graphic on the front. Made of cotton.",['Black'],Clothing
https://www.pullandbear.com/ae/playstation-x-stwd-lightweight-zipup-jacket-l07701512,299.00,715296126,"Lightweight PlayStation licensed jacket, with a high neck, half-zip fastening, and elastic cuffs and hem.Total look",['Black'],Clothing
https://www.pullandbear.com/ae/stwd-text-soccer-tshirt-l07151578,189.00,695434624,"Soccer T-shirt with contrast graphic and text, polo collar and short sleeves.",['Black'],Clothing
https://www.pullandbear.com/ae/stwd-hockey-tshirt-l07151577,169.00,695434626,"White hockey T-shirt with a contrast graphic and V-neck, short sleeves and made of slightly stretchy cotton.",['Off white'],Clothing
https://www.pullandbear.com/ae/playstation-x-stwd-joggers-l07674517,269.00,715296132,"PlayStation licensed joggers with a contrast graphic, panelled design, pockets and an elasticated waistband.Total look",['Off white'],Clothing
https://www.pullandbear.com/ae/striped-photo-print-tshirt-l07151536,129.00,715754925,"Short sleeve T-shirt with a horizontal striped design, a contrasting photo print on the side, and text on the front. Made from cotton.",['Off white'],Clothing
https://www.pullandbear.com/ae/short-sleeve-sweatshirt-with-giraffe-graphic-l07151539,169.00,715754926,Short sleeve sweatshirt with a round neck and a giraffe graphic on the front.,['Grey'],Clothing
https://www.pullandbear.com/ae/knit-sweater-with-embroidered-slogan-l07550516,219.00,715754927,"Long sleeve knit sweater with a contrast embroidered slogan on the front, a V-neck and ribbed trims. Made from 100% cotton.","['Black', 'Off white']",Clothing
https://www.pullandbear.com/ae/double-sleeve-shirt-l07472555,219.00,715754929,"Shirt featuring double sleeves, a Kent collar, button fastening and in poplin fabric.",['Off white'],Clothing
https://www.pullandbear.com/ae/long-sleeve-polo-shirt-l07200510,169.00,715754930,Long sleeve polo shirt with a Kent collar. Made of cotton.,"['Off white', 'Black']",Clothing
https://www.pullandbear.com/ae/short-sleeve-sweatshirt-with-graphic-l07151535,149.00,715754931,"Black short sleeve sweatshirt with graphic and text on the front and back, with a round neck and made of cotton.",['Black'],Clothing
https://www.pullandbear.com/ae/polo-collar-sweatshirt-l07200509,169.00,715754932,"Long sleeve sweatshirt with a polo collar, button fastening and ribbed trims.",['Grey'],Clothing
https://www.pullandbear.com/ae/wideleg-jeans-with-darts-l07687565,269.00,715754933,"Wide-leg high-rise jeans featuring dart details, with pockets, belt loops, and zipper fly and top button fastening.",['Grey'],Clothing
https://www.pullandbear.com/ae/denim-jacket-with-zipper-l07700550,299.00,715754934,"Long sleeve denim jacket with side pockets, zipper fastening and made of 100% cotton.",['Grey'],Clothing
https://www.pullandbear.com/ae/super-baggy-jacquard-trousers-l07674507,269.00,715754935,"Super baggy trousers in jacquard fabric, with a five-pocket design, belt loops and zipper fly and top button fastening.",['Grey'],Clothing
https://www.pullandbear.com/ae/short-sleeve-mosquito-sweatshirt-l07151537,169.00,715754937,Short sleeve sweatshirt with a round neck and a mosquito graphic on the front.,['Black'],Clothing
https://www.pullandbear.com/ae/stwd-hooded-zipup-jacket-l07700507,269.00,715754938,"Jacket in neoprene-effect fabric with a hood and zipper fastening, with long sleeves, an embroidered STWD logo on the front, and a pouch pocket.","['Chocolate', 'Navy', 'Black', 'Grey']",Clothing
https://www.pullandbear.com/ae/balloon-fit-jeans-with-embroidered-pocket-l03683512,299.00,715754939,"Balloon fit jeans featuring embroidered STWD logo and English key detail on the back pocket, five pockets and zipper fly and button fastening.","['Faded black', 'Medium blue']",Clothing
https://www.pullandbear.com/ae/stwd-apple-hoodie-l07560560,199.00,715754940,"Hoodie with an apple graphic and STWD logo, long sleeves and a front pouch pocket. Made from a cotton blend.",['Grey marl'],Clothing
https://www.pullandbear.com/ae/jacket-with-corduroy-collar-l07700520,269.00,692151735,"Lightweight cotton jacket with a contrasting corduroy collar, long sleeves, zip fastening, and front and side pockets.","['Deep green', 'Black', 'Leopard', 'Sand']",Clothing
https://www.pullandbear.com/ae/stwd-studio-hoodie-l07560521,219.00,715754942,Long sleeve hoodie with a pouch pocket and STWD Studio graphic on the front and back.,"['Pink', 'Blue']",Clothing
https://www.pullandbear.com/ae/stwd-studio-hoodie-l07560533,219.00,715754946,"Hoodie available in several colours, with contrast STWD Studio text, a front pouch pocket and made from cotton.","['White', 'Black', 'Red', 'Green']",Clothing
