pdp_url,prices,product_id,product_description,color,product_type
https://www.pullandbear.com/ae/bias-cut-tshirt-l07152715,119.00,705051415,Short sleeve T-shirt in bias cut fabric.,['Ochre'],Clothing
https://www.pullandbear.com/ae/washed-stwd-vest-top-l07550503,149.00,692161304,Washed vest top with an STWD graphic on the front. Made of 100% cotton.,['Cement'],Clothing
https://www.pullandbear.com/ae/black-metallica-tshirt-l07150908,129.00,692161305,Black short sleeve Metallica license T-shirt with a contrast graphic on the front and back and a round neck. Made of cotton.,['Black'],Clothing
https://www.pullandbear.com/ae/black-biascut-tshirt-l07152732,119.00,705051414,Black short sleeve T-shirt in bias-cut knit fabric.,['Black'],Clothing
https://www.pullandbear.com/ae/stwd-ibiza-soccer-tshirt-l07152571,189.00,713747228,"STWD soccer T-shirt with a checked design, 'Ibiza Calls' slogan, ribbed V-neck and short sleeves.",['Blue'],Clothing
https://www.pullandbear.com/ae/short-sleeve-sweatshirt-with-graphic-and-slogan-l07150701,149.00,692157214,"Short sleeve sweatshirt in interlock fabric with a ""Chase what you believe"" slogan on the front and a round neck.","['Blue', 'Beige', 'Black', 'Anthracite grey']",Clothing
https://www.pullandbear.com/ae/evangelion-tshirt-l07150553,129.00,692757293,Evangelion license short sleeve T-shirt with a round neck and front and back graphic. Made of 100% cotton.,['Beige'],Clothing
https://www.pullandbear.com/ae/short-sleeve-sweatshirt-with-shark-graphic-l07151538,169.00,692757295,"White short sleeve sweatshirt with a shark graphic on the back and contrast slogan on the front, with a crew neck and made from a cotton blend.",['Off white'],Clothing
https://www.pullandbear.com/ae/grey-evangelion-tshirt-l07150554,129.00,692757299,"Grey Evangelion license T-shirt with short sleeves and a round neck, with graphic on the front and back.",['Medium grey'],Clothing
https://www.pullandbear.com/ae/red-evangelion-tshirt-l07150555,129.00,692757300,"Red Evangelion license T-shirt with short sleeves and a round neck, with a graphic on the front and back, made of 100% cotton.",['Red'],Clothing
https://www.pullandbear.com/ae/faded-stwd-tshirt-l03248548,119.00,692757301,Washed STWD T-shirt with a round neck and short sleeves.,"['Grey', 'Green', 'Chocolate']",Clothing
https://www.pullandbear.com/ae/short-sleeve-tshirt-l03249599,99.00,703959863,Short sleeve T-shirt with a crew neck and a slogan graphic. Made of a cotton (98%) and viscose (2%) blend.,['Pale marl'],Clothing
https://www.pullandbear.com/ae/short-sleeve-penguin-sweatshirt-l07151544,169.00,692757317,"Short sleeve sweatshirt with a penguin graphic on the front and a contrast slogan on the back, with a round neck and made from a cotton blend.",['Pale grey'],Clothing
https://www.pullandbear.com/ae/tshirt-with-embroidered-vase-l03245589,99.00,692157257,Short sleeve T-shirt with a contrast embroidered vase and a round neck.,['Off white'],Clothing
https://www.pullandbear.com/ae/yellow-embroidered-tshirt-l03245588,99.00,692157258,Yellow short sleeve T-shirt with 'Elements in harmony' embroidery and a round neck.,['Olive'],Clothing
https://www.pullandbear.com/ae/floral-embroidered-tshirt-l03245587,99.00,692157263,Short sleeve T-shirt with floral embroidery and a round neck.,['Sand'],Clothing
https://www.pullandbear.com/ae/floral-embroidered-tshirt-l03245586,99.00,692157274,Short sleeve T-shirt with a round neck and cross-stitch embroidery of flowers and the slogan 'Harmonic naturelle'.,['Anthracite grey'],Clothing
https://www.pullandbear.com/ae/black-mona-lisa-tshirt-l07151927,119.00,692757340,Black short sleeve Leonardo da Vinci license T-shirt with a contrast Mona Lisa graphic on the front and back and a round neck. Made of cotton.,['Black'],Clothing
https://www.pullandbear.com/ae/van-gogh-sunflowers-tshirt-l07151918,119.00,692757341,"Van Gogh license T-shirt with a sunflower graphic on the front, a round neck and short sleeves.",['Off white'],Clothing
https://www.pullandbear.com/ae/textured-weave-tshirt-l07150705,149.00,692161374,Short sleeve T-shirt in textured fabric with a round neck and short sleeves.,"['Off white', 'Mint', 'Brown']",Clothing
https://www.pullandbear.com/ae/tshirt-with-stwd-logo-l07150531,99.00,692157279,Short sleeve T-shirt with a round neck and an STWD logo print on the front and back. Made of cotton.,['Mulberry'],Clothing
https://www.pullandbear.com/ae/van-gogh-a-wheatfield-with-cypresses-tshirt-l07151919,119.00,692757342,"Van Gogh license T-shirt with the painting 'Wheat Field with Cypresses', a round neck and short sleeves.",['Black'],Clothing
https://www.pullandbear.com/ae/tshirt-with-stwd-logo-l07245565,99.00,692757355,"Embroidered STWD logo T-shirt with short sleeves, a round neckline and a label detail on the hem. Made of 100% cotton.","['White', 'Off white', 'Black', 'Emerald', 'Red', 'Deep blue']",Clothing
https://www.pullandbear.com/ae/tank-top-l07152710,59.00,697267062,"Tank top with wide straps, a crew neck and made of 100% cotton.","['Green', 'Blue', 'White', 'Black']",Clothing
https://www.pullandbear.com/ae/stwd-short-sleeve-sweatshirt-l03598504,169.00,697267071,Washed STWD short sleeve sweatshirt with a round neck and embroidered logo.Total look,"['Black', 'Grey']",Clothing
https://www.pullandbear.com/ae/pack-of-basic-bermuda-shorts-and-tshirt-l03241999,149.00,692157325,Pack of basic T-shirt and Bermuda shorts. Available in several colours.,"['Navy', 'Sand', 'Black', 'Grey marl', 'Anthracite grey']",Clothing
https://www.pullandbear.com/ae/basic-muscle-fit-tshirt-l07249504,59.00,711068560,MUSCLE FIT. Basic T-shirt with short sleeves and a round neckline. Available in several plain colours. Made of 100% cotton.,"['White', 'Green', 'Black', 'Pale mink', 'Lead', 'Navy']",Clothing
https://www.pullandbear.com/ae/imagine-dragons-tshirt-l07150570,129.00,692157346,"Imagine Dragons license T-shirt with an eye graphic and slogan on the front and back, short sleeves and a round neck. Made of cotton.",['Sand'],Clothing
https://www.pullandbear.com/ae/stwd-tshirt-with-seams-and-slogan-l07150518,99.00,692161459,Blue short sleeve T-shirt with contrast seams and slogan and a round neck. Made of cotton.,['Medium blue'],Clothing
https://www.pullandbear.com/ae/stwd-panelled-tshirt-l07150517,99.00,692161460,"T-shirt with a colour block design, contrast ribbed trims and a round neck. Made of cotton.",['Off white'],Clothing
https://www.pullandbear.com/ae/striped-rustic-halter-top-l07150516,129.00,692161466,"Rustic T-shirt with short sleeves, a round neck and a striped design. Made of 100% cotton.",['Ochre'],Clothing
https://www.pullandbear.com/ae/imagine-dragons-tshirt-l07150571,129.00,692157374,"Imagine Dragons license short sleeve T-shirt with a round neck, front graphic and skull on the back.",['Pale grey'],Clothing
https://www.pullandbear.com/ae/boxyfit-american-football-tshirt-l07150594,99.00,692157388,"Boxy-fit T-shirt with short sleeves, a crew neck and an American football graphic. Made of 100% cotton.",['Off white'],Clothing
https://www.pullandbear.com/ae/extra-loose-tshirt-l07152570,99.00,694223826,Extra loose fit short sleeve T-shirt with a round neck. Made from 100% cotton. Available in a range of colours.,"['Grey', 'Black', 'White', 'Chocolate']",Clothing
https://www.pullandbear.com/ae/interlock-short-sleeve-sweatshirt-l07561901,129.00,692157399,"Short sleeve sweatshirt in interlock fabric, with a round neck and made of a cotton blend.",['Blue'],Clothing
https://www.pullandbear.com/ae/sakamoto-days-white-tshirt-l07151730,129.00,692161498,"Sakamoto Days license white T-shirt with a Taro Sakamoto character card graphic on the front and back, short sleeves and a crew neck.",['Off white'],Clothing
https://www.pullandbear.com/ae/sakamoto-days-stickers-tshirt-l07151367,129.00,708645865,"SAKAMOTO DAYS license T-shirt with a sticker graphic and contrast text, short sleeves, a round neck and an oversize fit. Made of cotton.",['Faded black'],Clothing
https://www.pullandbear.com/ae/metallica-skull-tshirt-l07150574,129.00,692157421,Short sleeve round neck Metallica license T-shirt with a skull graphic.,['Black'],Clothing
https://www.pullandbear.com/ae/embroidered-stwd-tshirt-l07150558,99.00,692161523,"Boxy fit T-shirt with STWD embroidery, a round neck and short sleeves.","['Green', 'Mauve', 'Black', 'White']",Clothing
https://www.pullandbear.com/ae/boxy-tshirt-l03248501,99.00,698993657,Boxy fit T-shirt with short sleeves and a round neck. Made of interlock fabric.,"['Pale marl', 'White', 'Black', 'Blue', 'Sand', 'Chocolate', 'Lead']",Clothing
https://www.pullandbear.com/ae/textured-short-sleeve-sweatshirt-l07561500,149.00,692157448,Short sleeve sweatshirt with a round neck. Made of cotton.,"['Off white', 'Sand', 'Pale green', 'Black']",Clothing
https://www.pullandbear.com/ae/short-sleeve-sweatshirt-l07561700,129.00,692157458,Basic short sleeve sweatshirt with a round neck. Made of interlock fabric.,['Chocolate'],Clothing
https://www.pullandbear.com/ae/short-sleeve-tshirt-with-stwd-graphic-l03249500,129.00,698625058,Short sleeve T-shirt with an STWD graphic and a round neck. Made of cotton.,"['Faded green', 'Pink', 'Off white']",Clothing
https://www.pullandbear.com/ae/washed-sleeveless-tshirt-l07151510,75.00,692157477,Sleeveless T-shirt with a round neck and ripped details. Made of washed-effect fabric.,"['Sand', 'Off white', 'Black']",Clothing
https://www.pullandbear.com/ae/stwd-football-tshirt-l07152537,189.00,703710251,"STWD football T-shirt in camouflage, with a V-neck and short sleeves.",['Dark brown'],Clothing
https://www.pullandbear.com/ae/short-sleeve-floral-sweatshirt-l07150540,149.00,692157493,Short sleeve sweatshirt in interlock fabric with a contrast graphic on the front and back and a round neck.,['Off white'],Clothing
https://www.pullandbear.com/ae/cactus-graphic-tshirt-l07150599,99.00,698625079,"Short sleeve T-shirt with a cactus graphic and contrasting slogan, a round neck and made of cotton.",['Ochre'],Clothing
https://www.pullandbear.com/ae/tshirt-with-embroidered-slogan-l07151514,99.00,698625080,"T-shirt with embroidered slogan and contrasting ribbed trims. Short sleeves, round neck and made of cotton.",['Ecru'],Clothing
https://www.pullandbear.com/ae/arcane-tshirt-l07151724,129.00,692161607,"Ecru Tupac license T-shirt with a graphic on the front and back, a round neck and short sleeves.",['Off white'],Clothing
https://www.pullandbear.com/ae/embroidered-short-sleeve-sweatshirt-l07150541,149.00,692157516,Short sleeve jacquard sweatshirt with a round neck. Made of interlock fabric.,['Black'],Clothing
https://www.pullandbear.com/ae/arcane-tshirt-l07151723,129.00,692161617,"Tupac license T-shirt with a graphic on the front and back, a round neck and short sleeves.",['Black'],Clothing
https://www.pullandbear.com/ae/interlock-short-sleeve-sweatshirt-l03590501,129.00,700509283,Sweatshirt with short sleeves and a round neck. Made of interlock sweatshirt fabric.Total look.,"['Off white', 'Black']",Clothing
https://www.pullandbear.com/ae/stwd-hockey-tshirt-l07150515,129.00,692157548,"Boxy fit short sleeve hockey-style T-shirt with a V-neck, an STWD logo on the front and a number on the sleeves.",['Off white'],Clothing
https://www.pullandbear.com/ae/washedeffect-number-tshirt-l07150514,129.00,692157556,"Black short sleeve T-shirt with a washed finish, a raised number 89 appliqué and a V-neck. Made of cotton.",['Black'],Clothing
https://www.pullandbear.com/ae/arcane-tshirt-l07151925,129.00,692157588,"Purple Arcane license T-shirt with a contrast graphic, round neck and short sleeves.",['Mulberry'],Clothing
https://www.pullandbear.com/ae/arcane-tshirt-l07151924,129.00,692157591,"Ecru Tupac license T-shirt with a graphic on the front and back, a round neck and short sleeves.",['Off white'],Clothing
https://www.pullandbear.com/ae/arcane-tshirt-l07151923,129.00,692157592,"Black Arcane license T-shirt with a graphic on the front and back, a round neck and short sleeves.",['Black'],Clothing
https://www.pullandbear.com/ae/arcane-tshirt-l07151524,129.00,692157594,"Dark grey boxy fit T-shirt with a contrast Arcane graphic, short sleeves and a round neck. Made of cotton.",['Anthracite grey'],Clothing
https://www.pullandbear.com/ae/short-sleeve-boxy-fit-tshirt-l07150506,99.00,692161691,Short sleeve boxy fit T-shirt with a round neck. Available in a range of colours and made of 100% cotton.,"['Green', 'Orange', 'Blue', 'Off white']",Clothing
https://www.pullandbear.com/ae/tshirt-with-embroidered-plants-l07150521,129.00,692157599,Short sleeve T-shirt with embroidered plants on the front and back and a round neck.,['Off white'],Clothing
https://www.pullandbear.com/ae/striped-do-not-disturb-tshirt-l07150593,99.00,693167264,Short sleeve round neck T-shirt with a striped design and 'Do not disturb' graphic on the front.,['Off white'],Clothing
https://www.pullandbear.com/ae/ribbed-waffleknit-tshirt-l07150522,149.00,692157600,Short sleeve waffle-knit T-shirt with a front pocket and contrast ribbing.,['Ecru'],Clothing
https://www.pullandbear.com/ae/think-limit-less-tshirt-l07150510,99.00,692151456,"T-shirt with short sleeves, a round neck and a slogan detail on the front. Made of cotton.",['Off white'],Clothing
https://www.pullandbear.com/ae/1978-boxyfit-tshirt-l07150559,99.00,693167269,"White boxy-fit T-shirt with a 1978 graphic on the front, 'Risk-Free Design' text on the back, a round neck and short sleeves.",['Off white'],Clothing
https://www.pullandbear.com/ae/embroidered-matisse-tshirt-l07151528,129.00,692151462,Dark grey Matisse license T-shirt with a contrast embroidered detail and a round neckline. Made of cotton.,['Dark grey'],Clothing
https://www.pullandbear.com/ae/blue-matisse-tshirt-l07151529,129.00,692151463,Blue Matisse license T-shirt with a contrast graphic and a round collar. Made of cotton.,['Deep blue'],Clothing
https://www.pullandbear.com/ae/henley-tshirt-l07151532,99.00,693167270,White short sleeve T-shirt with a henley neck and made of 100% cotton.,['Off white'],Clothing
https://www.pullandbear.com/ae/matisse-tshirt-l07151527,129.00,692151473,"Matisse license T-shirt with a contrast graphic, short sleeves and a round collar. Made of cotton.",['Off white'],Clothing
https://www.pullandbear.com/ae/van-gogh-room-tshirt-l07151926,119.00,692161719,Black short sleeve Vincent van Gogh license T-shirt with a contrast graphic on the front and back and a round neck. Made of cotton.,['Black'],Clothing
https://www.pullandbear.com/ae/short-sleeve-tshirt-with-trims-l07151511,99.00,692151497,Short sleeve T-shirt with a round neck. Made of cotton.,"['Black', 'Off white', 'Khaki', 'Grey', 'Chocolate']",Clothing
https://www.pullandbear.com/ae/short-sleeve-tshirt-with-slogan-l07150709,99.00,695878860,Short sleeve T-shirt with a contrast slogan. Made of cotton.,['Sand'],Clothing
https://www.pullandbear.com/ae/short-sleeve-tshirt-with-patches-l07150708,99.00,695878861,Short sleeve T-shirt with a contrast graphic. Made of cotton.,['Ecru'],Clothing
https://www.pullandbear.com/ae/embroidered-short-sleeve-sweatshirt-l07560541,149.00,697013455,Short sleeve boxy fit sweatshirt with embroidered slogans on the front and back and a round neck.,"['Off white', 'Navy']",Clothing
https://www.pullandbear.com/ae/boxy-tshirt-l07151710,99.00,695878865,Boxy-fit T-shirt with short sleeves and a round neck. Made of interlock fabric.,['Mulberry'],Clothing
https://www.pullandbear.com/ae/stwd-graffiti-tshirt-l07150922,129.00,695878867,Short sleeve STWD T-shirt with a graffiti graphic and round neck. Made of cotton.,['Sky blue'],Clothing
https://www.pullandbear.com/ae/ribbed-short-sleeve-tshirt-l07151525,99.00,692151509,Short sleeve T-shirt with contrast ribbed trims and a round neck. Made of a cotton and viscose blend.,"['White', 'Black', 'Pale marl']",Clothing
https://www.pullandbear.com/ae/dice-print-tshirt-l07150539,99.00,692151541,Short sleeve T-shirt with a round neck and a graphic on the front and back. Made of 100% cotton.,['Off white'],Clothing
https://www.pullandbear.com/ae/tshirt-with-the-great-wave-off-kanagawa-graphic-l07151516,119.00,692151544,"Boxy fit T-shirt with a graphic of The Great Wave of Kanagawa by Hokusai on the front and back, short sleeves and a round neck. Made of cotton.",['Anthracite grey'],Clothing
https://www.pullandbear.com/ae/interlock-short-sleeve-sweatshirt-l07150551,149.00,692151545,"Short sleeve sweatshirt in interlock fabric with floral embroidery on the front, a graphic on the back and a round neck.",['Ochre'],Clothing
https://www.pullandbear.com/ae/gnx-car-graphic-tshirt-l07150903,119.00,692151548,"GNX license boxy fit T-shirt with a car graphic on the front, a round neck and short sleeves.",['Black'],Clothing
https://www.pullandbear.com/ae/short-sleeve-abstract-movement-sweatshirt-l07150552,149.00,692151549,Short sleeve sweatshirt in interlock fabric with a contrast graphic on the front and back and a round neck.,['Off white'],Clothing
https://www.pullandbear.com/ae/miami-tiger-tshirt-l07150538,99.00,692151551,"Interlock T-shirt with a pink car, tiger and palm tree print, a Miami slogan, a round neck and short sleeves.",['Ecru'],Clothing
https://www.pullandbear.com/ae/gnx-graphic-tshirt-l07150549,119.00,692151552,"White GNX license T-shirt with a contrast car graphic and slogan, short sleeves and a round neck. Made of cotton.",['White'],Clothing
https://www.pullandbear.com/ae/basic-short-sleeve-cotton-tshirt-l03245504,59.00,692151556,Basic short sleeve T-shirt with a round neck. Made of 100% cotton.,"['White', 'Black', 'Emerald', 'Pink', 'Bluish grey', 'Blue']",Clothing
https://www.pullandbear.com/ae/striped-tom-and-jerry-embroidered-tshirt-l07150902,129.00,692151563,Tom and Jerry license short sleeve T-shirt with a contrast striped design and graphic and a round neck. Made of cotton.,['Green'],Clothing
https://www.pullandbear.com/ae/cocktail-cup-tshirt-l07150537,99.00,692151564,"Short sleeve T-shirt with a cocktail glass graphic, 'Fruit Soda' slogan and round neck.",['Navy'],Clothing
https://www.pullandbear.com/ae/white-tom-and-jerry-tshirt-l07150901,119.00,692151565,White short sleeve Tom and Jerry license T-shirt with a contrast graphic on the front and back and a round neck. Made of cotton.,['Off white'],Clothing
https://www.pullandbear.com/ae/soul-holidays-tshirt-l07150536,99.00,692151568,"Short sleeve T-shirt with a round neck, a 'Soul Holidays' slogan on the front and a photo of a house with a swimming pool on the back.",['Off white'],Clothing
https://www.pullandbear.com/ae/tom--jerry-striped-tshirt-l07150548,129.00,692151571,"Tom & Jerry license striped T-shirt with an embroidered graphic on the front, a round neck and short sleeves.",['Pink'],Clothing
https://www.pullandbear.com/ae/tom--jerry-tshirt-l07150547,119.00,692151575,"Navy blue Tom & Jerry license T-shirt with graphic on the front and back, a round neck and short sleeves.",['Navy'],Clothing
https://www.pullandbear.com/ae/tom--jerry-tshirt-l07150546,119.00,692151577,"White Tom & Jerry license T-shirt with a front graphic, round neck, contrast ribbed detail and short sleeves.",['Off white'],Clothing
https://www.pullandbear.com/ae/tom--jerry-tshirt-l07150725,119.00,692151600,"Tom & Jerry license T-shirt with a front graphic, round neck and short sleeves.",['Off white'],Clothing
https://www.pullandbear.com/ae/le-penseur-graphic-tshirt-l07151518,119.00,692151607,"White boxy fit T-shirt with a Auguste Rodin ""Le Penseur"" sculpture graphic on the front and back, short sleeves and a round neck. Made of cotton.",['Off white'],Clothing
https://www.pullandbear.com/ae/stwd-mesh-tshirt-l07152523,149.00,695434559,Boxy short sleeve T-shirt with an STWD logo. Made of mesh fabric.,"['Green', 'White']",Clothing
https://www.pullandbear.com/ae/grey-acdc-tshirt-l07151588,129.00,695907693,"AC/DC license T-shirt with a graphic on the front, a “Rock N’ Roll Damnation” slogan on the back, short sleeves and a round collar. Made of cotton.",['Grey'],Clothing
https://www.pullandbear.com/ae/acdc-tshirt-l07151587,129.00,695907694,Short sleeve AC/DC license T-shirt with a round collar. Made of cotton.,['Off white'],Clothing
https://www.pullandbear.com/ae/acdc-tshirt-l07151932,129.00,695907695,"ADCD license T-shirt with short sleeves, a crew neck and an ACDC graphic on the front. Made of 100% cotton.",['Grey'],Clothing
https://www.pullandbear.com/ae/squid-game-doublelayer-tshirt-l07152926,189.00,698445171,"Squid Game license double-layer T-shirt with a contrast graphic on the front, a round neck and short sleeves. Made of 100% cotton.",['Green'],Clothing
https://www.pullandbear.com/ae/squid-game-ribbed-tshirt-l07152925,129.00,698445173,"Squid Game license T-shirt with a contrast graphic on the front, contrast ribbed details, a round neck and short sleeves. Made of 100% cotton.",['White'],Clothing
https://www.pullandbear.com/ae/squid-game-doll-tshirt-l07152924,129.00,698445174,"Squid Game license T-shirt with a contrast doll graphic on the front and back, a round neck and short sleeves. Made of 100% cotton.",['Anthracite grey'],Clothing
https://www.pullandbear.com/ae/green-squid-game-tshirt-l07152525,129.00,698445177,"Green Squid Game license T-shirt with a contrast graphic on the front and back, a round neck and short sleeves. Made of 100% cotton.",['Green'],Clothing
https://www.pullandbear.com/ae/white-squid-game-tshirt-l07152524,129.00,698445178,"White Squid Game license T-shirt with a contrast graphic on the front and back, a round neck and short sleeves. Made of 100% cotton.",['White'],Clothing
https://www.pullandbear.com/ae/faded-stwd-tshirt-l03245577,99.00,694046088,Short sleeve faded T-shirt with a crew neck and a contrast graphic print on the front and back. Made of 100% cotton.,['Grey'],Clothing
https://www.pullandbear.com/ae/stwd-print-tshirt-with-chain-l03245575,99.00,694046089,"Washed STWD T-shirt with a chain print, a round neck, ripped details and short sleeves.",['Black'],Clothing
https://www.pullandbear.com/ae/true-self-faded-tshirt-l03245578,99.00,694046090,Washed short sleeve T-shirt with a crew neck and graphic on the front and back. Made of 100% cotton.,['Black'],Clothing
https://www.pullandbear.com/ae/the-reception-graphic-tshirt-l07150595,99.00,692151703,"White short sleeve T-shirt with a contrasting graphic and 'The Reception' text, and a round neck. Made of cotton.",['White'],Clothing
https://www.pullandbear.com/ae/tshirt-with-contrast-seams-l07150512,129.00,692151714,"Short sleeve T-shirt with contrast seams, a round neck and a front pocket. Made of 100% cotton.Total look",['Off white'],Clothing
https://www.pullandbear.com/ae/beige-tshirt-with-pocket-l07151557,99.00,695434667,Beige short sleeve T-shirt with a front pocket featuring 'Warm Sand' text and a round neck.,['Off white'],Clothing
https://www.pullandbear.com/ae/orange-tshirt-with-pocket-l07151556,99.00,695434669,"Orange short sleeve T-shirt with a front pocket with a coral graphic, text on the back 'Great Summer' and a round neck.",['Orange'],Clothing
https://www.pullandbear.com/ae/green-tshirt-with-pocket-l07151555,99.00,695434670,Green short sleeve T-shirt with 'Chill Waves' text on the front pocket and a round neck.,['Green'],Clothing
https://www.pullandbear.com/ae/tshirt-with-sun-pocket-l07151533,59.00,695434671,"Short sleeve T-shirt with a sun graphic on the front pocket, 'Island Escape' text and a round neck.",['Navy'],Clothing
https://www.pullandbear.com/ae/short-sleeve-boxy-sweatshirt-l07150560,149.00,693161404,"Black short sleeve sweatshirt with a boxy fit, 'In the middle of nowhere' slogan, graphic on the back and a round neck.",['Black'],Clothing
https://www.pullandbear.com/ae/stwd-mesh-fabric-tshirt-l07151500,149.00,692151753,"Short sleeve T-shirt with a V-neck, STWD logo and mesh fabric.Total look.","['Sand', 'Black', 'Grey']",Clothing
https://www.pullandbear.com/ae/sakamoto-days-ticket-tshirt-l07151368,129.00,708646346,"White SAKAMOTO DAYS license T-shirt with a contrast ticket graphic, short sleeves, a round neck, an oversize fit and made of cotton.",['Ice'],Clothing
https://www.pullandbear.com/ae/pink-sakamoto-days-tshirt-l07150380,129.00,708646347,"Pink SAKAMOTO DAYS licensed T-shirt with a contrast graphic, short sleeve, round neck, oversize fit, and made from cotton.",['Pink'],Clothing
https://www.pullandbear.com/ae/black-sakamoto-days-tshirt-l07150381,129.00,708646345,"Washed black SAKAMOTO DAYS license T-shirt with a pink graphic and contrast text, short sleeves, a round neck, an oversize fit, and made of cotton.",['Faded black'],Clothing
https://www.pullandbear.com/ae/short-sleeve-stwd-tshirt-l03248530,99.00,701515213,Boxy fit T-shirt with short sleeves and a round neck. Made of 100% cotton.,"['Off white', 'Black']",Clothing
https://www.pullandbear.com/ae/primavera-sound-x-pb-vest-top-l07012503,119.00,697494992,Round neck vest top from the Primavera Sound x PB collection. Made of cotton.,"['White', 'Black']",Clothing
https://www.pullandbear.com/ae/primavera-sound-x-pb-waffleknit-tshirt-l07012504,169.00,697494994,Waffle-knit T-shirt from the Primavera Sound x PB collection with long sleeves and a round neck. Made of cotton.,['Off white'],Clothing
https://www.pullandbear.com/ae/primavera-sound-x-pb-black-tshirt-l07012502,129.00,697494995,Black short sleeve T-shirt from the Primavera Sound x PB collection with a contrast graphic and a round neck. Made of cotton.,['Black'],Clothing
https://www.pullandbear.com/ae/textured-short-sleeve-sweatshirt-l03598502,75.00,701515220,Short sleeve sweatshirt with a round neck. Made of cotton.,"['Black', 'Off white', 'Grey']",Clothing
https://www.pullandbear.com/ae/cropped-tshirt-l07151530,99.00,702129740,"Cropped short sleeve T-shirt with a round neck, in 100% cotton.","['Pale marl', 'Sand', 'Chocolate', 'Off white', 'Black', 'Sky blue', 'Duck green']",Clothing
