product_url,name,product_code,currency,price,price_per_unit,ingredients,nutri_score_letter,description,imges_url
https://www.delhaize.be/fr/shop/Fruits-et-legumes-frais/Legumes-frais/Asperges/Asperges-vertes/Asperges-Vertes-Bio/p/F1996021400300720000,Green asparagus | Bio,F1996021400300720000,€,7.99,,Green asparagus* 100% *From organic agriculture,A,Packaged green asparagus | from Hesbaye,['https://www.delhaize.be/medias/sys_master/hf9/hf6/12512708984862.jpg']
https://www.delhaize.be/fr/shop/Fruits-et-legumes-frais/Jus-de-fruits-frais-et-smoothies/Jus-de-fruits-frais/Jus-Orange-Kiwi/p/F2012011600338600000,Juice | Orange-Kiwi,F2012011600338600000,€,2.29,,"Orange 80%, kiwi 20%",C,"Jus frais 100% fruits, fraichement pressé, un délicieux mélange d'orange 80% et 20% de kiwi.Riche en vitamine C.Le produit a l'extra coeur","['https://www.delhaize.be/medias/sys_master/h58/h24/12036681465886.jpg', 'https://www.delhaize.be/medias/sys_master/hce/hdc/12036681859102.jpg', 'https://www.delhaize.be/medias/sys_master/h00/h4b/12036682186782.jpg']"
https://www.delhaize.be/fr/shop/Fruits-et-legumes-frais/Jus-de-fruits-frais-et-smoothies/Jus-de-fruits-frais/Jus-Pomme-Bio/p/F2015071300351200000,Juice | Apple | Bio,F2015071300351200000,€,3.49,,Apple juice* 100% *From organic agriculture.,C,Typique de la pomme Bio,"['https://www.delhaize.be/medias/sys_master/products/h20/hd7/13059504898078.jpg', 'https://www.delhaize.be/medias/sys_master/products/hdc/h46/13059505291294.jpg', 'https://www.delhaize.be/medias/sys_master/products/h3c/ha3/13059505618974.jpg']"
https://www.delhaize.be/fr/shop/Fruits-et-legumes-frais/Jus-de-fruits-frais-et-smoothies/Smoothies/Super-smoothie-Recharge-Frais/p/F2020051100058740000,Super smoothie | Recharge | Fresh,F2020051100058740000,€,2.79,,"1 ½ pommes pressées (68%), 2 mandarines pressées (16%), ⅓ banane écrasée, ⅓ carotte pressée (4,4%), de la pêche écrasée, un filet de citron, un soupçon d&apos;infusion au gingembre (0,35%), graines de lin (0,07%), une pincée de curcuma, des vitamines (B1, B2, B6, C, E et niacine).",,"10 % de nos bénéfices sont reversés à des associations caritatives Sans sucres ajoutés ni conservateurs Sans concentré Riche en vitamines B1 et C vitamines Mélange de mandarines, carottes, pommes, gingembre, graines de lin et",['https://www.delhaize.be/medias/sys_master/products/hb8/hae/13114800963614.jpg']
https://www.delhaize.be/fr/shop/Fruits-et-legumes-frais/Legumes-prets-a-l-emploi/Legumes-predecoupes/Autres-legumes-predecoupes/Spaghettis-de-courgettes/p/F2022041100098610000,Zucchini | Spaghetti,F2022041100098610000,€,2.49,,Zucchini 100%,A,Courgettes comme alternative aux spaghettis,['https://www.delhaize.be/medias/sys_master/products/hc2/h65/13068816023582.jpg']
https://www.delhaize.be/fr/shop/Fruits-et-legumes-frais/Jus-de-fruits-frais-et-smoothies/Jus-de-fruits-frais/Jus-frais-Presse-Orange/p/F2017012500369000000,Freshly squeezed juice | Orange,F2017012500369000000,€,1.59,,Orange juice 100%.,C,Freshly squeezed orange juice					. 					. 					.,"['https://www.delhaize.be/medias/sys_master/he6/he9/12036663967774.jpg', 'https://www.delhaize.be/medias/sys_master/he3/h07/12036664360990.jpg', 'https://www.delhaize.be/medias/sys_master/h3f/hc3/12036664688670.jpg']"
https://www.delhaize.be/fr/shop/Fruits-et-legumes-frais/Jus-de-fruits-frais-et-smoothies/Jus-de-fruits-frais/Jus-Grenade/p/F2012061100368100000,Juice | Pomegranate,F2012061100368100000,€,3.99,,Pomegranate juice 100%,D,Mélange doux de fruits rouges,"['https://www.delhaize.be/medias/sys_master/h97/h62/11023944351774.jpg', 'https://www.delhaize.be/medias/sys_master/h92/h9f/11023944744990.jpg', 'https://www.delhaize.be/medias/sys_master/hef/h3b/11023945072670.jpg']"
https://www.delhaize.be/fr/shop/Fruits-et-legumes-frais/Jus-de-fruits-frais-et-smoothies/Limonades-fraiches/Raw-Lemonade-Citron-Limette-Gingembre-Frais/p/F2017112900370080000,Raw Lemonade | Lime-Lemon-Ginger | Fresh,F2017112900370080000,€,2.29,,"Water 82%, agave syrup 7%, lemon juice 5%, lime juice 5%, ginger juice 1,5%",D,"limette 5%, agave 7%, gingembre 1,5%. Limonade fraîche avec fraîchement pressé avec de l'eau 81,5%, citron 5%,","['https://www.delhaize.be/medias/sys_master/hfa/hee/12034965110814.jpg', 'https://www.delhaize.be/medias/sys_master/h2f/h7e/12034965504030.jpg', 'https://www.delhaize.be/medias/sys_master/h5f/hdc/12034965831710.jpg']"
https://www.delhaize.be/fr/shop/Fruits-et-legumes-frais/Jus-de-fruits-frais-et-smoothies/Shots/shot-Passion-For-Ginger/p/F2022090100106570000,shot | Passion For Ginger,F2022090100106570000,€,1.19,,"Apple 59%, ginger 25%, passionfruit 8%, lemon 4%, apple concentrate 4%, antioxidant (ascorbic acid).",E,Ces boissons ont été spécialement conçues pour les personnes qui souhaitent un peu de piquant. Ce shot est à base de gingembre. Ajoutez une goutte de pommes fraîchement pressées et de fruits de la passion et vous obtiendrez un stimulant qui fait son effet !,"['https://www.delhaize.be/medias/sys_master/products/h2b/hec/13060700110878.jpg', 'https://www.delhaize.be/medias/sys_master/products/h09/ha3/13060700504094.jpg', 'https://www.delhaize.be/medias/sys_master/products/hc6/hfe/13060700831774.jpg']"
https://www.delhaize.be/fr/shop/Fruits-et-legumes-frais/Jus-de-fruits-frais-et-smoothies/Jus-de-fruits-frais/Multivitamins-Jus-Fruits-90Cl/p/F2020012100050460000,Juice | Multivitamins,F2020012100050460000,€,5.19,,"Jus et purées de fruits (pomme (37%), orange (14%), raisin blanc (11%), ananas (8%), abricot (7%), pêche, mandarine, kaki, fruit de la passion (4%), mangue (2%), banane (2%), citron),  vitamines C, E, B6, B2, B1 et bêta-carotène",C,Jus de fruits frais à base de 12 fruits.,['https://www.delhaize.be/medias/sys_master/h88/hed/12116891762718.jpg']
https://www.delhaize.be/fr/shop/Fruits-et-legumes-frais/Jus-de-fruits-frais-et-smoothies/Shots/Shot-Pink-Dragon/p/F2022090100106510000,Shot | Pink Dragon,F2022090100106510000,€,1.19,,"Orange 72%, apple 25%, pitahaya 2%, Guarana 0,5%, antixoidant (ascorbic acid).",C,"C'est surtout pour ceux qui ont un peu de piquant que ces shots ont été mis au point. Ce shot est à base de guarana. Ajoutez une goutte d'oranges, de pommes et de pitahayas fraîchement pressées et vous obtiendrez un booster qui fait son effet !","['https://www.delhaize.be/medias/sys_master/products/h16/h29/13060737073182.jpg', 'https://www.delhaize.be/medias/sys_master/products/h60/h68/13060737466398.jpg', 'https://www.delhaize.be/medias/sys_master/products/hca/h18/13060737794078.jpg']"
https://www.delhaize.be/fr/shop/Fruits-et-legumes-frais/Noix-et-fruits-secs/Fruits-secs/Autres-fruits-secs/Mangue-Nature/p/S2021011900496780000,Natural Mango,S2021011900496780000,€,2.39,,"Mango 99.9%, preservative [sulphur dioxide (SULFITE)].",D,MANGUE NATURE,['https://www.delhaize.be/medias/sys_master/products/hc8/h98/12964638326814.jpg']
https://www.delhaize.be/fr/shop/Fruits-et-legumes-frais/Legumes-frais/Autres-legumes-frais/Mais/Mais-Doux/p/F2021080300084680000,Sweetcorn,F2021080300084680000,€,2.99,,Sweet corn 100%.,,Deux épis de maïs sucré dans un seul emballage. Le maïs est sucré et croquant.,['https://www.delhaize.be/medias/sys_master/h78/h6a/12512603734046.jpg']
https://www.delhaize.be/fr/shop/Fruits-et-legumes-frais/Legumes-prets-a-l-emploi/Legumes-predecoupes/Legumes-predecoupes-pour-la-soupe/Potage-courgettes/p/F2022050200099590000,Zucchini | soup,F2022050200099590000,€,4.29,,"Zucchini 60,5%, garden peas 16,5%, leek 13,1%, onion 6,6%, broth powder 2,2% (salt, onion 18,3%, garlic 13,2%, herbs and spices, tomato 9,9%, carrot 5%, natural flavour, yeast extract), parsley 1,1%.",B,"Paquet de potage pour préparer une potage de brocoli et épinard, avec un sachet de bouillon en poudre","['https://www.delhaize.be/medias/sys_master/products/hce/h46/13068909019166.jpg', 'https://www.delhaize.be/medias/sys_master/products/h28/h87/13068909412382.jpg']"
https://www.delhaize.be/fr/shop/Fruits-et-legumes-frais/Jus-de-fruits-frais-et-smoothies/Jus-de-fruits-frais/Jus-Clementine-Brique-Pure-Classic/p/F1995050200352800000,Juice | Clementine | Brik | Pure Classic,F1995050200352800000,€,3.19,,Jus de Clémentine (100%)clementine juice (100%),C,Clementine Juice,['https://www.delhaize.be/medias/sys_master/products/h02/h6f/13060725604382.jpg']
https://www.delhaize.be/fr/shop/Fruits-et-legumes-frais/Jus-de-fruits-frais-et-smoothies/Jus-de-fruits-frais/Banana-Passion-Fruit-Jus-Fruits-90Cl/p/F2021020800076470000,Trop | Banana | Pass,F2021020800076470000,€,5.19,,"Jus de pomme, jus d&apos;ananas, purée de banane, purée de fruit de la passion.",D,Jus de fruits frais à base de banane et de fruit de la passion.,['https://www.delhaize.be/medias/sys_master/products/h84/h2f/12643664298014.jpg']
https://www.delhaize.be/fr/shop/Fruits-et-legumes-frais/Legumes-frais/Herbes-et-epices/Herbes-et-epices-emballees/Estragon-Emballe/p/F2021022500077670000,Tarragon | Packed,F2021022500077670000,€,1.79,,Tarragon 100%,A,"Une des herbes les plus utilisées de la cuisine française, au goût anisé.",['https://www.delhaize.be/medias/sys_master/products/h50/hdf/13057075052574.jpg']
https://www.delhaize.be/fr/shop/Fruits-et-legumes-frais/Legumes-frais/Ail-et-oignon/Echalotes/Echalote-oignon-filet/p/F2022102600109220000,Shallot | Onion,F2022102600109220000,€,1.05,,Shallots 100%,A,"Les échalotes sont de petits oignons à la saveur douce et au goût subtilement sucré, qui se situent à mi-chemin entre l'oignon et l'ail. Leur peau est fine, de couleur brun clair à violette, et leur chair est fine et croquante.",['https://www.delhaize.be/medias/sys_master/products/h3c/h65/12928800784414.jpg']
https://www.delhaize.be/fr/shop/Epicerie-salee/Soupes/Soupes-fraiches/Soupes-chaudes/Soupe-Poulet/p/F2021072800084220000,Soup | Chicken,F2021072800084220000,€,3.49,,"Water, vegetables (CELERIAC, carrot, leek, CELERY, onion), roasted chicken meat 5% (cooked chicken meat 92%, water, tapioca starch, salt, dextrose, D-xylose, stabilisers (E331, E500ii)), dietary fiber, pea, chicken broth 2,1% [chicken extract, yeast extract, maltodextrine, chicken fat, rice starch, salt, vegetable extracts (carrot, onion), lemon juice, spice extracts (pepper, turmeric) lovage extract], modified corn starch, CELERIAC, pasta (durum WHEAT semolina, water, barn EGG white), stock (flavour, yeast extract), yeast extract, vegetable broth powder [salt, yeast extract, potato starch, non hydrogenated sunflower oil, vegetable extracts (onion, leek, tomato, carrot, lovage), onion powder, garlic, herbs and spices], salt, colour (carotenes), laurel.",A,Soupe au poulet et légumes,['https://www.delhaize.be/medias/sys_master/products/h29/hec/13068963348510.jpg']
https://www.delhaize.be/fr/shop/Fruits-et-legumes-frais/Noix-et-fruits-secs/Noix/Noix/Noix-Pecan-Bio/p/S2021010800488670000,Nuts | Pecan | Bio,S2021010800488670000,€,7.55,,PECAN NUTS* 100%. *From organic agriculture.,A,NOIX DE PECAN BIO,"['https://www.delhaize.be/medias/sys_master/h01/h99/12555078041630.jpg', 'https://www.delhaize.be/medias/sys_master/h4c/hd8/12555078434846.jpg']"
https://www.delhaize.be/fr/shop/Fruits-et-legumes-frais/Soupes-fraiches/Soupes-froides/Gazpacho-Suave/p/F2005050400214600000,Gazpacho | Suave,F2005050400214600000,€,4.89,,,B,rlic...,['https://www.delhaize.be/medias/sys_master/hc6/h7d/11999440666654.jpg']
https://www.delhaize.be/fr/shop/Fruits-et-legumes-frais/Boites-repas/Boites-repas-pour-plats/Avec-des-legumes-non-coupes/Boite-de-repas-Pasta-funghi/p/F2022122000113860000,Mealbox | Pasta funghi,F2022122000113860000,€,5.89,,"Brown button mushroom (Agaricus bisporus) 40%, leek 22%, yellow onion 15%, red onion 10%, red bell pepper 9%, seasoning mix 1.4% (salt, onion, tomato, yeast extract, garlic, thyme, parsley, black pepper, lovage root, turmeric), garlic 1.2%, thyme 0.6%, rosemary 0.3%, oregano 0.3%, sage 0.3%.",C,"Bien entendu, les pâtes savoureuses ne peuvent manquer dans notre assortiment ! Ce classique, rehaussé de la touche typique de Delhaize, ne vous laissera pas indifférent.",['https://www.delhaize.be/medias/sys_master/products/h8e/he6/13114521583646.jpg']
https://www.delhaize.be/fr/shop/Fruits-et-legumes-frais/Boites-repas/Boites-repas-pour-plats/Avec-des-legumes-non-coupes/Boite-de-repas-Orzo-epinard-tomates/p/F2023032300118860000,Mealbox | Orzo spinach tomato,F2023032300118860000,€,5.89,,"Zucchini 25%, tomato 23%, orzo 17% (durum WHEAT semolina), yellow onion 11%, red onion 8,6%, red bell pepper 7,7%, concentrated tomato puree 6% [tomato, acidity regulator (citric acid)], seasoning mix 1,5% (salt, onion, fennel seeds, oregano, laurel, black pepper, rosemary, chili pepper, garlic).",A,"Un plat unique à base de pâtes grecques typiques, complété par de savoureux légumes frais et un bon mélange d'herbes.",['https://www.delhaize.be/medias/sys_master/h1a/h0a/12512829374494.jpg']
https://www.delhaize.be/fr/shop/Fruits-et-legumes-frais/Legumes-frais/Autres-legumes-frais/Mini-legumes/Brocoli-chou-fleur-Mini-Bio/p/F2015031200329100000,Mini broccoli/cauliflower | Bio,F2015031200329100000,€,4.99,,"Cauliflower* 50%, broccoli* 50%. *From organic agriculture",A,"Duo de mini-brocoli et de mini-chou-fleur bio. Même goût que leur version traditionnelle mais plus amusants à présenter, surtout pendant les fêtes !",['https://www.delhaize.be/medias/sys_master/h16/h0a/12287039045662.jpg']
https://www.delhaize.be/fr/shop/Fruits-et-legumes-frais/Jus-de-fruits-frais-et-smoothies/Kombucha/Kombucha-Raw-Pineapple-Chili-Bio/p/F2020080300064350000,Kombucha | Raw | Pineapple Chili | Bio,F2020080300064350000,€,2.49,,"Yugen Kombucha * (filtered water, kombucha culture, sugar *, infusion * (green tea * (0.2%), black tea * (0.2%), lime zest *, lemongrass *, cucumber*, chili*(0.1%))) (96%),  pineapple juice* (4%) - * Organic farming",C,"Yugen Kombucha Pineapple Chili is een biologische, ongepasteuriseerde kombucha verrijkt met puur ananassap, spicy chili, en een kruidige cocktail van citroengras, limoenzest en komkommer. Deze mocktail is halal, vegan en voorzien van een clean label.","['https://www.delhaize.be/medias/sys_master/products/hc3/h0a/12736769687582.jpg', 'https://www.delhaize.be/medias/sys_master/products/h04/ha8/12736770080798.jpg']"
https://www.delhaize.be/fr/shop/Fruits-et-legumes-frais/Legumes-prets-a-l-emploi/Legumes-predecoupes/Autres-legumes-predecoupes/Frites-patates-douces/p/F2022041100098580000,Sweet potato | fries,F2022041100098580000,€,2.99,,Sweet potato 100%,B,Frites de patates douces fraîchement coupées,['https://www.delhaize.be/medias/sys_master/products/ha5/h33/13068928352286.jpg']
https://www.delhaize.be/fr/shop/Fruits-et-legumes-frais/Legumes-frais/Herbes-et-epices/Herbes-et-epices-emballees/Tiges-de-citronnelle-Emballe/p/F2021022500077580000,Lemon grass |  Packed,F2021022500077580000,€,2.29,,Lemongrass 100%.,A,"La citronnelle a une saveur d'agrumes et de citron avec un soupçon de menthe. Les tiges ont une saveur fraîche et citronnée, avec une touche de gingembre.",['https://www.delhaize.be/medias/sys_master/products/ha5/h38/13057066074142.jpg']
https://www.delhaize.be/fr/shop/Epicerie-salee/Soupes/Soupes-fraiches/Soupes-chaudes/Soupe-Thai-curry-rouge/p/F2021072700084070000,Soup | Red Thai curry,F2021072700084070000,€,3.99,,"Water, coconut milk 13% (coconut extract, water), cherry tomato, cream preparation [cream (MILK), corn starch], onion, tomato passata, CELERIAC, leek, carrot, chicken broth (concentrated broth of chicken meat, maltodextrin, yeast extract, salt, glucose, onion powder), chicory fiber, ginger, potato flake, lime juice, paste with spices 0,4% [spices 56% (dried red chili, coriander seed, cumin powder), lemongrass, garlic, shallot, salt, kaffir lime skin, galangal], garlic, concentrated tomato puree, modified corn starch, coriander, yeast extract, spice extract 0,02%, lemongrass, kaffir lime leave, salt.",B,Soupe Thai curry rouge,['https://www.delhaize.be/medias/sys_master/products/h4d/h7d/13068785483806.jpg']
https://www.delhaize.be/fr/shop/Fruits-et-legumes-frais/Jus-de-fruits-frais-et-smoothies/Jus-de-fruits-frais/Jus-Pomme-et-baies-Frais/p/F2017021500381900000,Juice | Apple and berries | Fresh,F2017021500381900000,€,3.59,,,C,"10 % de nos bénéfices sont reversés à des associations caritatives' Sans sucres ajoutés ni conservateurs Sans concentré Jus de pomme, fraise, cassis et raisin",['https://www.delhaize.be/medias/sys_master/products/h63/h0c/13114388807710.jpg']
https://www.delhaize.be/fr/shop/Fruits-et-legumes-frais/Jus-de-fruits-frais-et-smoothies/Jus-de-fruits-frais/Jus-Pomme-et-mangue-Frais/p/F2018091300024100000,Juice | Apple and mango | Fresh,F2018091300024100000,€,3.59,,"7 ½ pommes pressées (94%), ½ mangue écrasée (6,5%), un zeste de vitamine C",C,10 % de nos bénéfices sont reversés à des associations caritatives Sans sucres ajoutés ni conservateurs Sans concentré Jus de pomme et de mangue,['https://www.delhaize.be/medias/sys_master/products/ha8/hcd/13114556317726.jpg']
https://www.delhaize.be/fr/shop/Fruits-et-legumes-frais/Legumes-prets-a-l-emploi/Salade-en-sachet/Salades-vertes/ROQUETTE-100G/p/F2020082500066710000,RUCOLA | 100G,F2020082500066710000,€,1.29,,Rocket,,"Roquette.Déjà lavé, prêt à l'emploi.",['https://www.delhaize.be/medias/sys_master/products/hd0/h87/13102108999710.jpg']
https://www.delhaize.be/fr/shop/Fruits-et-legumes-frais/Jus-de-fruits-frais-et-smoothies/Smoothies/Super-smoothie-Revitalise-Frais/p/F2022070400103180000,Super smoothie | Revitalise | Fresh,F2022070400103180000,€,2.79,,"1 pomme pressée (45%), ¾ poire écrasée, un doigt de betterave pressée, un doigt de grenade pressée (6,4%), 5 framboises écrasées (4,6%), 9 cassis écrasés, 3 canneberges écrasées (1,5%), graines de lin (0,35%), un peu de baobab écrasé, des vitamines (B1, B2, B6, C, E, niacine)",,"10 % de nos bénéfices sont reversés à des associations caritatives' Sans sucres ajoutés ni conservateurs Sans concentré Riche en vitamines B1, B2, B3, B6 et C vitamines Mélange de pommes, canneberges, framboises, grenades, graines de lin et",['https://www.delhaize.be/medias/sys_master/products/h56/h00/13114334281758.jpg']
https://www.delhaize.be/fr/shop/Fruits-et-legumes-frais/Legumes-prets-a-l-emploi/Legumes-predecoupes/Autres-legumes-predecoupes/Riz-de-chou-fleur/p/F2022041100098550000,Cauliflower | rice,F2022041100098550000,€,2.69,,Cauliflower 100%,A,Le chou-fleur comme alternative de riz,['https://www.delhaize.be/medias/sys_master/products/hb6/h6d/13068880511006.jpg']
https://www.delhaize.be/fr/shop/Fruits-et-legumes-frais/Jus-de-fruits-frais-et-smoothies/Jus-de-fruits-frais/Jus-de-citron-frais/p/F2022062200102390000,DLL |  Lemon juice,F2022062200102390000,€,2.19,,"Water 61%, Lemon 29%, agave 10%",E,"Jus fraîchement pressé avec du citron, de l'eau et de l'agave. Pressé à froid quotidiennement, sans additifs","['https://www.delhaize.be/medias/sys_master/products/hd2/h16/13060708958238.jpg', 'https://www.delhaize.be/medias/sys_master/products/hd5/hf8/13060709351454.jpg', 'https://www.delhaize.be/medias/sys_master/products/h7a/h3d/13060709679134.jpg']"
https://www.delhaize.be/fr/shop/Fruits-et-legumes-frais/Noix-et-fruits-secs/Fruits-secs-en-ingredients/Graine-et-pignon/Pignons-de-pin/p/S2021011900496970000,Pinenut kernels,S2021011900496970000,€,6.39,,"Pine nuts 100%. Made in a factory that also uses: peanuts, soy, milk, nuts, sesame and sulfite.",C,"encore plus la saveur, les pignons de pin ont été torréfiés. graines sont riches en vitamines, minéraux et protéines. Pour rehausser pommes de pin. Après la récolte, ils sont pelés, lavés et séchés. Les Les pignons de pin sont les graines d'un pin et sont cachés dans les","['https://www.delhaize.be/medias/sys_master/products/h24/hd0/13035005935646.jpg', 'https://www.delhaize.be/medias/sys_master/products/h12/hf9/13035006328862.jpg', 'https://www.delhaize.be/medias/sys_master/products/h7c/ha9/13035006656542.jpg']"
https://www.delhaize.be/fr/shop/Fruits-et-legumes-frais/Legumes-prets-a-l-emploi/Legumes-predecoupes/Autres-legumes-predecoupes/Brocoli/p/F2014102800302320000,Broccoli,F2014102800302320000,€,2.39,,Broccoli 100%,A,,['https://www.delhaize.be/medias/sys_master/products/h37/h6b/13068852199454.jpg']
https://www.delhaize.be/fr/shop/Fruits-et-legumes-frais/Jus-de-fruits-frais-et-smoothies/Smoothies/Super-smoothie-Defence-Frais/p/F2020051100058780000,Super smoothie | Defense | Fresh,F2020051100058780000,€,3.39,,"1 ½ pommes pressées (68%), ¾ banane écrasée, ⅓ mangue écrasée (11%), un soupçon de fruit de la passion, du lait de coco onctueux (1,6%), ½ cerise acérola écrasée, un filet de citron vert, un soupçon d&apos;infusion au gingembre (0,25%), fibres végétales d&apos;agrumes, des vitamines (B1, B2, B6, C, E, niacine)",E,"10 % de nos bénéfices sont reversés à des associations caritatives' Sans sucres ajoutés ni conservateurs Sans concentré Riche en vitamines B1, B2, B3, B6 et C de gingembre et de vitamines Mélange de fruits écrasés, de jus de fruits, de lait de coco, d'infusion",['https://www.delhaize.be/medias/sys_master/products/hcc/hc5/13114624278558.jpg']
https://www.delhaize.be/fr/shop/Fruits-et-legumes-frais/Legumes-frais/Choux-et-broccolis/Broccolis-et-autres-choux/Chou-frise-Bio/p/F2018100300025150000,Kale | Bio,F2018100300025150000,€,5.99,,Kale* 100% *From organic agriculture,A,Son nom vient du fait que les extrémités de ses feuilles épaisses sont frisées. Le chou frisé a une saveur puissante qui se marie bien avec les produits salés.,['https://www.delhaize.be/medias/sys_master/products/h40/h05/12834562736158.jpg']
https://www.delhaize.be/fr/shop/Fruits-et-legumes-frais/Jus-de-fruits-frais-et-smoothies/Jus-de-fruits-frais/Jus-Myrtille-cassis-et-pomme-Frais/p/F2017021600382000000,"Juice | Blueberry, blackcurrant and apple | Fresh",F2017021600382000000,€,3.59,,"6 pommes pressées, 22 raisins blancs pressés, 79 baies de cassis pressées (7%), ⅓ de poire mixée, 132 myrtilles pressées (4%), 9 canneberges mixées (1,5%)",C,"innocent Blueberry, blackcurrant & cranberry juice 900ml",['https://www.delhaize.be/medias/sys_master/products/h58/h7b/13114685095966.jpg']
https://www.delhaize.be/fr/shop/Fruits-et-legumes-frais/Legumes-frais/Autres-legumes-frais/Autres-petits-legumes/Ail-Frais/p/F2019032600034400000,Fresh Garlic,F2019032600034400000,€,2.39,,Garlic 100%,,"il devient beaucoup plus doux et plus aromatique. À l'état brut, il reste très puissant. L'ail est un véritable exhausteur de goût utilisé dans toutes sortes de plats. Si vous faites chauffer l'ail (par exemple au four),",['https://www.delhaize.be/medias/sys_master/h20/h1b/12022990438430.jpg']
https://www.delhaize.be/fr/shop/Fruits-et-legumes-frais/Legumes-frais/Herbes-et-epices/Herbes-et-epices-emballees/Sauge-Emballe/p/F2021022500077610000,Salbe | Packed,F2021022500077610000,€,1.79,,Sage 100%,A,"La sauge a des feuilles veloutées, gris-vert. À utiliser avec parcimonie car la sauge a un goût très prononcé.",['https://www.delhaize.be/medias/sys_master/products/h92/h7a/13057065418782.jpg']
https://www.delhaize.be/fr/shop/Fruits-et-legumes-frais/Jus-de-fruits-frais-et-smoothies/Smoothies/Smoothie-fraise-chia-250ml/p/F2021042100079970000,Smoothie | strawberry chia 250ml,F2021042100079970000,€,1.99,,"Apple 55%, strawberry 30%, banana 12%, elderberry 2%, chia seed (Salvia hispanica) 1%, antioxidant (ascorbic acid).",C,"Smoothie avec pomme, fraise, sureau et chia. 250ml","['https://www.delhaize.be/medias/sys_master/products/hfe/h2f/13060698800158.jpg', 'https://www.delhaize.be/medias/sys_master/products/h29/h4c/13060699193374.jpg', 'https://www.delhaize.be/medias/sys_master/products/ha6/h56/13060699521054.jpg']"
https://www.delhaize.be/fr/shop/Fruits-et-legumes-frais/Noix-et-fruits-secs/Noix/Mix/Noix-Melange-Grillee-Bio/p/S2021010800488620000,Nuts | Roasted | Mix | Bio,S2021010800488620000,€,4.69,,"CASHEW NUTS* 29%, HAZELNUTS* 19 %, ALMONDS* 19%, white ALMONDS* 19%, MACADAMIA NUTS* 9,8%, non hydrogenated sunflower oil*, sea salt 1%. *From organic agriculture.",B,MELANGE DE NOIX GRILLEES ET SALEES BIO,"['https://www.delhaize.be/medias/sys_master/h47/h8e/12554939367454.jpg', 'https://www.delhaize.be/medias/sys_master/haf/h3f/12554939760670.jpg']"
https://www.delhaize.be/fr/shop/Fruits-et-legumes-frais/Soupes-fraiches/Soupes-froides/Gazpacho-Tomates/p/F2012042300281500000,Gazpacho | Tomatoes,F2012042300281500000,€,3.39,,,A,Soupe froide à base de tomates fraîches.,['https://www.delhaize.be/medias/sys_master/hac/hac/11999490998302.jpg']
https://www.delhaize.be/fr/shop/Fruits-et-legumes-frais/Noix-et-fruits-secs/Noix/Pistaches/Pistaches-Bio/p/S2022030100610440000,Pistachios | Bio,S2022030100610440000,€,10.99,,"Pistachio* (NUTS) 99%, seasalt 1% *From organic production",B,Pistaches Bio 400g,"['https://www.delhaize.be/medias/sys_master/products/h41/hfa/13112272257054.jpg', 'https://www.delhaize.be/medias/sys_master/products/h4a/h2c/13112272650270.jpg']"
https://www.delhaize.be/fr/shop/Fruits-et-legumes-frais/Legumes-frais/Betteraves-navets-et-fenouil/Betteraves/Petit-betterave-rouge-Balsamique-Bio/p/F2019031400033610000,Babybeets |Balsamico | Bio,F2019031400033610000,€,2.99,,"Beetroot* 87%, balsamic marinade 9% (wine vinegar*, grape must*), apple juice concentrate* 4%. *From organic agriculture",A,"Des petites betteraves biologiques aromatisées qui donnent une dimension supplémentaire à ce produit déjà sain et savoureux. D'une part par la facilité et les possibilités d'utilisations, d'autre part le fait que c'est surprenant.","['https://www.delhaize.be/medias/sys_master/products/h9c/hdd/13124038688798.jpg', 'https://www.delhaize.be/medias/sys_master/products/hd7/hf9/13124039082014.jpg', 'https://www.delhaize.be/medias/sys_master/products/hbb/h63/13124039409694.jpg']"
