product_url,name,product_code,currency,price,price_per_unit,ingredients,nutri_score_letter,description,imges_url
https://www.delhaize.be/fr/shop/Eaux-Softdrinks-and-Jus/Jus-de-fruits-frais-et-smoothies/Eaux-kefir-et-autres/Eau-de-noix-Bio/p/F2024120500150150000,Coconut water | Bio,F2024120500150150000,€,6.99,,,,Rebel Kitchen Eau de noix de coco frais,['https://www.delhaize.be/medias/sys_master/products/hac/h6b/12935587954718.jpg']
https://www.delhaize.be/fr/shop/Eaux-Softdrinks-and-Jus/Jus-de-fruits-frais-et-smoothies/Eaux-kefir-et-autres/Eau-de-noix-de-coco-Bio/p/F2024121000150450000,Coconut water | Bio,F2024121000150450000,€,2.99,,,,Eau de noix de coco frais BIO,['https://www.delhaize.be/medias/sys_master/products/h1e/h10/12935633698846.jpg']
https://www.delhaize.be/fr/shop/Fruits-et-legumes-frais/Legumes-frais/Choux-et-broccolis/Broccolis-et-autres-choux/Chou-fleur-Bio/p/F2024120900150440000,Cauliflower | Bio,F2024120900150440000,€,3.99,,Cauliflower* 100% * From organic agriculture,A,BIO Chou-fleur 1 pc,['https://www.delhaize.be/medias/sys_master/products/h43/h1b/12944691462174.jpg']
https://www.delhaize.be/fr/shop/Fruits-et-legumes-frais/Legumes-prets-a-l-emploi/Legumes-predecoupes/Autres-legumes-predecoupes/Legumes-pour-pates-Cavolo-nero-Courgett/p/F2023061200122050000,Pasta vegetables | Cavolo Nero | Courgette,F2023061200122050000,€,3.29,,"Chestnut mushroom 43%, zucchini 24%, leek 18%, cavolo nero 14%, garlic 2.3%",A,"Legumes pour pates cavolo nero, courgette, champignons bruns",['https://www.delhaize.be/medias/sys_master/products/h1b/h08/13068818645022.jpg']
https://www.delhaize.be/fr/shop/Fruits-et-legumes-frais/Jus-de-fruits-frais-et-smoothies/Limonades-fraiches/Mocktail-Tropical-Sunset/p/F2023121100128690000,Mocktail | Tropical Sunset,F2023121100128690000,€,2.49,,"Orange 35%, water, pineapple 20%, mango 10%, cranberry 5%.",C,"Mocktail avec orange, mangue, ananas et eau.","['https://www.delhaize.be/medias/sys_master/products/h7c/h96/13060726259742.jpg', 'https://www.delhaize.be/medias/sys_master/products/h2a/h35/13060726652958.jpg', 'https://www.delhaize.be/medias/sys_master/products/hbf/h84/13060726980638.jpg']"
https://www.delhaize.be/fr/shop/Eaux-Softdrinks-and-Jus/Jus-de-fruits-frais-et-smoothies/Jus-de-fruits-frais/Jus-Ananas-Citron-Menthe/p/F2024041700134240000,Juice | Pineapple | Lemon | Mint,F2024041700134240000,€,1.49,,"Apple 75%, pineapple 25%, lemon 0.5%, mint 0.1% antioxidant (ascorbic acid).",C,"Jus avec pomme, ananas, citron et menthe. 250ml","['https://www.delhaize.be/medias/sys_master/h78/hef/12547620044830.jpg', 'https://www.delhaize.be/medias/sys_master/hfd/h80/12547620438046.jpg', 'https://www.delhaize.be/medias/sys_master/h2d/hdf/12547620765726.jpg']"
https://www.delhaize.be/fr/shop/Fruits-et-legumes-frais/Jus-de-fruits-frais-et-smoothies/Jus-de-fruits-frais/Jus-Pommes/p/F2024041700134270000,Juice | Apple,F2024041700134270000,€,2.19,,"Apple 100%, antioxidant (ascorbic acid).",C,100% jus de pomme. 500ml,"['https://www.delhaize.be/medias/sys_master/products/h73/he8/12656814129182.jpg', 'https://www.delhaize.be/medias/sys_master/products/he6/h4b/12656814522398.jpg', 'https://www.delhaize.be/medias/sys_master/products/haf/h03/12656814850078.jpg']"
https://www.delhaize.be/fr/shop/Eaux-Softdrinks-and-Jus/Jus-de-fruits-frais-et-smoothies/Smoothies/Smoothie-Sweet-Bleuberry-Muffin/p/F2024032800134030000,Smoothie | Sweet | Bleuberry | Muffin,F2024032800134030000,€,1.99,,"Apple juice 43%, fermented coconut product 25% [coconut creme 52%, water, modified maize starch, thickener (carrageenan), starter cultures], blueberry juice 20%, banana puree 8%, agave syrup, natural vanilla flavouring 0.1%, antioxidant (ascorbic acid)",E,"Smoothie avec yaourt à la noix de coco, myrtille, banane et pomme.","['https://www.delhaize.be/medias/sys_master/products/h3c/hcf/13060642832414.jpg', 'https://www.delhaize.be/medias/sys_master/products/h67/h1c/13060643487774.jpg', 'https://www.delhaize.be/medias/sys_master/products/h53/h58/13060644012062.jpg']"
https://www.delhaize.be/fr/shop/Fruits-et-legumes-frais/Jus-de-fruits-frais-et-smoothies/Jus-de-fruits-frais/Jus-Pommes-Fraises/p/F2024041700134280000,Juice | Apple | Strawberry,F2024041700134280000,€,3.79,,"Apple 80%, strawberry 20%, antioxidant (ascorbic acid).",C,Jus avec pomme et fraise. 1000ml,"['https://www.delhaize.be/medias/sys_master/products/hcf/h72/12695624351774.jpg', 'https://www.delhaize.be/medias/sys_master/products/hc9/haf/12695624744990.jpg', 'https://www.delhaize.be/medias/sys_master/products/h27/h4c/12695625072670.jpg']"
https://www.delhaize.be/fr/shop/Fruits-et-legumes-frais/Soupes-fraiches/Soupes-chaudes/Soupe-Tomates-Legumes-Boulettes-de-viande/p/F2023032900119320000,soep | Tomaten | Groenten | Balletjes,F2023032900119320000,€,4.99,,"Eau, 21% purée de tomate, 6,7% carotte, 4,7% boulettes (volaille (viande de poulet, viande de dinde), chapelure (FARINE DE BLÉ (GLUTEN), SON DE BLÉ (GLUTEN), sel, levure), fibres alimentaires, sirop de glucose, amidon, sel de mer, épices), 4,3% poireau, 4,0% CÉLERI-RAVE, 2,4% CÉLERI, 2,2% oignon, amidon de riz, pois, panais, sucre de canne, sel de mer, poivron rouge, poivron vert, extrait de levure, jus de citron fait de concentré, arômes naturels, ail, poudre d&apos;oignon, arôme légume naturel (contient CÉLERI), poivre blanc, persil, laurier, basilic, origan. Peut contenir des traces d&apos;oeufs, lait (y compris le lactose), soja. Contient 43% de légumes.",,"Un copieux bouillon à base de tomates avec des légumes croustillants et des boulettes juteuses, c'est tout ce dont il a besoin ! Et comme vous en avez l'habitude chez Butterfly : 100 % naturel, donc sans exhausteurs de goût ni conservateurs.","['https://www.delhaize.be/medias/sys_master/products/hbc/h92/12788392558622.jpg', 'https://www.delhaize.be/medias/sys_master/products/hea/h38/12788392951838.jpg']"
https://www.delhaize.be/fr/shop/Fruits-et-legumes-frais/Soupes-fraiches/Soupes-chaudes/Soupe-Jardin-potager-Boulettes-de-viande/p/F2023032900119270000,Vegetable soup | meatballs,F2023032900119270000,€,4.99,,"Eau, 6,2% panais, 6,2% CÉLERI-rave, potiron, 4,8% pois, 4,7% boulettes (volaille (viande de poulet, viande de dinde), chapelure (farine de BLÉ (GLUTEN), son de BLÉ (GLUTEN), sel,levure), fibres alimentaires, sirop de glucose, amidon, sel de mer, épices), oignon cuit, 2,9% carotte, pomme de terre, poireau, CRÈME de cuisson (LAIT, CRÈME , amidon), amidon de riz, sel de mer, extrait de levure, concentré de jus de panais, sucre de canne, arômes naturels (contient LAIT et OEUF), arôme carotte naturel, persil, curcuma, poivre blanc. Peut contenir des traces de soja.",,"Du céleri-rave aux panais, en passant par le potiron et la carotte : cette soupe est une véritable explosion de saveurs et de vitamines ! Les boules juteuses complètent cette soupe de légumes. Et comme vous en avez l'habitude chez Butterfly : 100 % naturel, donc sans exhausteurs de goût ni conservateurs.","['https://www.delhaize.be/medias/sys_master/products/h2e/hb8/12788419756062.jpg', 'https://www.delhaize.be/medias/sys_master/products/h75/hfa/12788420149278.jpg']"
https://www.delhaize.be/fr/shop/Fruits-et-legumes-frais/Noix-et-fruits-secs/Noix/Amandes/Amandes-mediterraneennes/p/S2024093000791740000,Mediterranean almonds,S2024093000791740000,€,4.99,,"ALMONDS 95%, maize starch, rosemary, tomato powder, oregano, smoked paprika, salt.",A,Amandes méditerranéennes,['https://www.delhaize.be/medias/sys_master/products/h3f/hcb/12853199601694.jpg']
https://www.delhaize.be/fr/shop/Epicerie-salee/Noix-et-fruits-secs/Noix/Noix/Cajou-Cacahouete-miel/p/S2024093000791760000,Cashew | Pean honey,S2024093000791760000,€,3.99,,"PEANUTS 47%, CASHEW NUTS 47%, mustard and honey seasoning 3.8% [sugar, spices (MUSTARD seeds 32%, ginger, white pepper, turmeric), salt, natural MUSTARD seed flavouring, garlic powder, honey powder 2% (maltodextrin, honey 45%), anti-caking agent (silicon dioxide), acid (citric acid), non hydrogenated sunflower oil], non hydrogenated sunflower oil, horseradish, fenugreek.",C,Cacahuètes et cajou - miel/moutarde,['https://www.delhaize.be/medias/sys_master/products/hda/hde/13021576265758.jpg']
https://www.delhaize.be/fr/shop/Epicerie-salee/Noix-et-fruits-secs/Noix/Noix/Cajou-Aneth-pickels/p/S2024093000791880000,Cashew Dill Pickled,S2024093000791880000,€,3.99,,"CASHEW NUTS 93%, pickling seasoning 3,8% [spices (turmeric, MUSTARD seed, coriander seed, ginger, cumin seed, chili pepper, black pepper), potato starch, dried glucose syrup, acidity regulator (sodium acetates), salt, sugar, onion powder, anti-caking agent (silicon dioxide), non hydrogenated rapeseed oil, acid (malic acid), herbs (dill seed, baby leaf, lovage leaf), natural MUSTARD flavouring], non hydrogenated sunflower oil.",C,Noix de cajou pickels,['https://www.delhaize.be/medias/sys_master/products/h38/h30/12853142454302.jpg']
https://www.delhaize.be/fr/shop/Fruits-et-legumes-frais/Noix-et-fruits-secs/Noix/Mix/Extra-Hot-mix/p/S2024100900792880000,Extra Hot mix,S2024100900792880000,€,2.89,,"PEANUTS 67%, CASHEW NUTS 29%, spicy seasoning 3.5% (sea salt, paprika, chili pepper), stabiliser (gum arabic).",C,Melange extra piquant,"['https://www.delhaize.be/medias/sys_master/products/h81/h25/12853158510622.jpg', 'https://www.delhaize.be/medias/sys_master/products/hc8/h19/12853158903838.jpg']"
https://www.delhaize.be/fr/shop/Fruits-et-legumes-frais/Noix-et-fruits-secs/Noix/Mix/Melan-noix-Truff/p/S2024100900792870000,Nutmix | Truffle,S2024100900792870000,€,4.99,,"ALMONDS 31%, CASHEW NUTS 31%, PEANUTS 31%, truffle powder seasoning 3.5 % [dried summer truffle (Tuber aestivum) 29%, buckwheat flour, maltodextrin, flavouring], brown sugar (sugar, caramel, inverted sugar syrup), salt, chickpea flour.",B,Mélange de noix au goût de truffe,['https://www.delhaize.be/medias/sys_master/products/h18/hed/12984277532702.jpg']
https://www.delhaize.be/fr/shop/Fruits-et-legumes-frais/Noix-et-fruits-secs/Noix/Noix/Noix-de-cajou-Grillees/p/S2023080100717270000,Cashew nuts | Roasted,S2023080100717270000,€,2.45,,CASHEW NUTS 100%.,B,elles sont triées par qualité et par taille. Les noix de cajou proviennent principalement du Vietnam et de l'Inde où,"['https://www.delhaize.be/medias/sys_master/products/h5a/h6b/13112363810846.jpg', 'https://www.delhaize.be/medias/sys_master/products/h32/hf0/13112364204062.jpg']"
https://www.delhaize.be/fr/shop/Fruits-et-legumes-frais/Noix-et-fruits-secs/Noix/Noix/Noix-Cajou/p/S2023081700719560000,Cashew nuts,S2023081700719560000,€,2.89,,CASHEW NUTS 100%,C,Noix Cajou,['https://www.delhaize.be/medias/sys_master/products/h81/hff/13023879102494.jpg']
https://www.delhaize.be/fr/shop/Fruits-et-legumes-frais/Noix-et-fruits-secs/Noix/Noix/NOIX-DE-CAJOU/p/S2023073100717120000,CASHEW NUTS | PILLOW,S2023073100717120000,€,6.09,,Roasted CASHEWS 100%.,B,NOIX DE CAJOU 500G,"['https://www.delhaize.be/medias/sys_master/products/h19/he6/12971300880414.jpg', 'https://www.delhaize.be/medias/sys_master/products/h2a/hbd/12971301273630.jpg']"
https://www.delhaize.be/fr/shop/Fruits-et-legumes-frais/Fruits-frais/Fruit-snacks/FB-mini-Ananas/p/F2024010800129660000,FB mini | Pineapple,F2024010800129660000,€,2.25,,Pineapple 100%,A,Salade de fruit,['https://www.delhaize.be/medias/sys_master/hc5/h44/12623203729438.jpg']
https://www.delhaize.be/fr/shop/Fruits-et-legumes-frais/Noix-et-fruits-secs/Fruits-secs/Abricots-raisins-et-pruneaux/Abricots-Bio/p/S2024062500717310098,Apricots | Bio,S2024062500717310098,€,3.15,,Dried apricots*. *From organic agriculture,C,DLL ABRICOTS BIO 200G,"['https://www.delhaize.be/medias/sys_master/products/h37/h9a/13021532946462.jpg', 'https://www.delhaize.be/medias/sys_master/products/hf9/h6e/13021533339678.jpg']"
https://www.delhaize.be/fr/shop/Fruits-et-legumes-frais/Fruits-frais/Fruits-exotiques/Autres-fruits-exotiques/Noix-de-coco-Bio/p/F2024092600148230000,Coconut | Bio,F2024092600148230000,€,1.69,,Coconut* 100% *From organic agriculture,D,"L'eau de coco a un goût rafraîchissant. La chair a un goût doux, de noisette et sucré.",['https://www.delhaize.be/medias/sys_master/products/h8d/h8d/12991117033502.jpg']
https://www.delhaize.be/fr/shop/Fruits-et-legumes-frais/Fruits-frais/Fruit-snacks/Ananas-Morceaux/p/F2024052800136330000,Pineapple | Pieces,F2024052800136330000,€,4,,Pineapple 100%,A,Salade de fruit,['https://www.delhaize.be/medias/sys_master/products/hfb/hd6/13114642890782.jpg']
https://www.delhaize.be/fr/shop/Fruits-et-legumes-frais/Soupes-fraiches/Soupes-chaudes/Soupe-Legumes/p/F2023110300127420000,Soup | Vegetables,F2023110300127420000,€,3.49,,"Eau, carotte, 5,7% CELERI-RAVE, 4,8% poireau, CELERI, 3,1% oignon, pois, amidon de riz, concentré de jus de panais, vermicelles (SEMOULE DE BLE (GLUTEN), eau, PROTEINE D&apos;ŒUF), arôme naturel, sel de mer, extrait de levure, arôme CELERI-RAVE naturel, arôme carotte naturel, ail, poudre d&apos;oignon, arôme légume naturel (contient CELERI), persil, poivre blanc. Peut contenir des traces de soja, lait (y compris le lactose). Contient 28% de légumes.",,Soupe de légumes,['https://www.delhaize.be/medias/sys_master/products/h91/ha5/12849231986718.jpg']
https://www.delhaize.be/fr/shop/Fruits-et-legumes-frais/Soupes-fraiches/Soupes-chaudes/Minestrone/p/F2023110300127430000,Minestrone,F2023110300127430000,€,3.49,,"Eau, 22% purée de tomates d&apos;origine de concentré de tomates, 7,1% carotte, 4,5% poireau, 4,2% CELERI-RAVE, 2,5% CELERI, 2,3% oignon, amidon de riz, pois, panais, sucre de canne, sel de mer, poivron rouge, poivron vert, 0,5% FUSILLI (SEMOULE DE BLE DUR (GLUTEN)), extrait de levure, jus de citron fait de concentré, arômes naturels, 0,2% ail, poudre d&apos;oignon, arôme légume naturel (contient CELERI), poivre blanc, 0,01% persil, laurier, basilic, origan. Peut contenir des traces de lait (y compris le lactose), oeufs, soja.",,Soupe minestrone,['https://www.delhaize.be/medias/sys_master/products/hef/h16/12849245421598.jpg']
https://www.delhaize.be/fr/shop/Fruits-et-legumes-frais/Soupes-fraiches/Soupes-chaudes/Veloute-de-tomates-Boulettes/p/F2023110300127440000,Tomato cream soup | Meatballs,F2023110300127440000,€,3.49,,"Eau, 28% purée de tomates d&apos;origine de concentré de tomates, carotte, CELERI-RAVE, 5,5% CREME DE CUISSON (LAIT, CREME, amidon), 4,7% boulettes (volaille (viande de poulet, viande de dinde), chapelure (FARINE DE BLE (GLUTEN), SON DE BLE (GLUTEN), sel, levure), fibres alimentaires, sirop de glucose, amidon, sel de mer, épices), oignon cuit, poireau, amidon de riz, sucre de canne, sel de mer, arômes naturels (contient OEUF), extrait de levure, poivre blanc. Peut contenir des traces de soja.",,Velouté de tomates avec boulettes,['https://www.delhaize.be/medias/sys_master/products/hc3/h50/12849256693790.jpg']
https://www.delhaize.be/fr/shop/Fruits-et-legumes-frais/Soupes-fraiches/Soupes-chaudes/Soupe-Butternut-Carottes/p/F2023110300127450000,Soup | Butternut | Carrot,F2023110300127450000,€,3.49,,"Eau, 16% courge butternut, 6,7%carotte, CÉLERI-RAVE, 4,7% boulettes (volaille (viande de poulet, viande de dinde), chapelure (FARINE DE BLÉ (gluten), SON DE BLÉ (gluten), sel, levure), fibres alimentaires, sirop de glucose, amidon, sel de mer, épices), oignon cuit, amidon de riz, poireau, sel de mer, sucre de canne, extrait de levure, arômes naturels (contient OEUF), poivre blanc. Peut contenir des traces de lait (y compris le lactose), soja.",,Soupe butternut et carottes avec boulettes,['https://www.delhaize.be/medias/sys_master/products/h0a/h59/12849264558110.jpg']
https://www.delhaize.be/fr/shop/Fruits-et-legumes-frais/Soupes-fraiches/Soupes-chaudes/Soupe-Legumes-Poulet/p/F2023110300127460000,Soup | Vegetables | Chicken,F2023110300127460000,€,3.49,,"Eau, 9,1% carotte, CELERI-RAVE, poireau, 4,7% cubes de poulet (4,6% poulet, sel), 4,0% CELERI, pois, amidon de riz, oignon, sel de mer, vermicelles (SEMOULE DE BLE (GLUTEN), eau, PROTEINE D&apos;ŒUF), arômes naturels (contient OEUF), sucre de canne, poudre de poireau, 0,02% persil, curcuma, arôme épice naturel, graines de CELERI, poivre blanc. Peut contenir des traces de lait (y compris le lactose), soja. Contient 26% de légumes.",,Soupe de poulet aux légumes,['https://www.delhaize.be/medias/sys_master/products/hb0/ha2/12849275699230.jpg']
https://www.delhaize.be/fr/shop/Fruits-et-legumes-frais/Noix-et-fruits-secs/Fruits-secs/Dattes-et-figues/Dattes-Medjool/p/S2024073000782990000,Medjool Dates,S2024073000782990000,€,4.99,,Dates 100%.,D,DATTES MEDJOOL,['https://www.delhaize.be/medias/sys_master/products/hba/hbd/13016585535518.jpg']
https://www.delhaize.be/fr/shop/Fruits-et-legumes-frais/Noix-et-fruits-secs/Fruits-secs-en-ingredients/Graine-et-pignon/Tournesols-Grilles/p/S2023070600483120098,Gril | Salt | Sunflower | Seed,S2023070600483120098,€,1.85,,"Sunflower seeds 88%, salt 10%, rice flour.",D,Ces graines de tournesol ne sont pas pelées mais immédiatement torréfiées et salées. Leur donnent un goût unique.,"['https://www.delhaize.be/medias/sys_master/hff/h2b/12552120008734.jpg', 'https://www.delhaize.be/medias/sys_master/hf6/ha1/12552120401950.jpg', 'https://www.delhaize.be/medias/sys_master/h64/h19/12552120729630.jpg']"
https://www.delhaize.be/fr/shop/Fruits-et-legumes-frais/Noix-et-fruits-secs/Noix/Noix/Mix-Kenya-Sale/p/S2023071000483170098,Salted | Mix | Kenya,S2023071000483170098,€,4.19,,"PEANUTS 50%, ALMONDS 19%, CASHEW NUTS 19%, MACADAMIA NUTS 8%, non hydrogenated sunflower oil, salt 1%.",C,"Le mélange salé Kenya se compose pour près de 50% de noix de qualité salées telles que les amandes, les noix de cajou et les macadam macadamias et est en outre complété par des arachides salées argentines.","['https://www.delhaize.be/medias/sys_master/products/hb2/hf4/13021595336734.jpg', 'https://www.delhaize.be/medias/sys_master/products/h53/hce/13021595729950.jpg', 'https://www.delhaize.be/medias/sys_master/products/h0a/hce/13021596057630.jpg']"
https://www.delhaize.be/fr/shop/Fruits-et-legumes-frais/Boites-repas/Boites-repas-pour-plats/Avec-legumes-pre-coupes/Boite-de-repas-Pre-coupe-Waterzooi/p/F2023062600122280000,Mealbox | Pre-cut| Waterzooi,F2023062600122280000,€,6.89,,"Vegetable mix 49% (carrot 24%, CELERY 24%, leek 24%, onion 24%, parsley 2,4%), precooked potato 48%, vegetable broth cube 2,4% [salt, flavour enhancer (monosodium glutamate), corn starch, yeast extract, SOY protein extract, non hydrogenated palm oil, natural flavourings (contains CELERY), vegetables 1,9% (tomato, onion, leek, carrot, cabbage), parsley, onion extract, carrot extract, antioxidant (rosemary extracts)], garlic 0,6%.",B,"Un plat typiquement belge à base de poulet, de légumes, de crème et de pommes de terre. Cette boîte repas est facile à préparer et contient juste ce qu'il faut, donc pas de gaspillage.",['https://www.delhaize.be/medias/sys_master/h3c/hf4/12523231739934.jpg']
https://www.delhaize.be/fr/shop/Fruits-et-legumes-frais/Boites-repas/Boites-repas-pour-plats/Avec-legumes-pre-coupes/Boite-de-repas-Pre-coupe-One-pot-pasta/p/F2023062900122450000,Mealbox | Pre-cut | One pot pasta,F2023062900122450000,€,6.89,,"Vegetable mix 39% (zucchini 29%, leek 29%, red bell pepper 21%, yellow bell pepper 21%), whole grain pasta penne 33% (whole grain durum WHEAT semolina), cherry tomato 11%, tomato puree 7,8% [tomato paste 99,9%, acid (citric acid)], spinach 5,6%, seasoning 1,1% (herbs, garlic, salt, pepper), vegetable broth cube 1,1% [salt, flavour enhancer (monosodium glutamate), corn starch, yeast extract, SOY protein extract, non hydrogenated palm oil, natural flavourings (contains CELERY), vegetables 1,9% (tomato, onion, leek, carrot, cabbage), parsley, onion extract, carrot extract, antioxidant (rosemary extracts)], garlic 0.6%",C,Un plat de pâtes pour lequel vous n'avez besoin qu'un seul plat. Tellement astucieux! La boîte contient des ingrédients frais et beaucoup de légumes.,['https://www.delhaize.be/medias/sys_master/products/hb9/h08/12675404300318.jpg']
https://www.delhaize.be/fr/shop/Vite-et-vraiment-bon/Pret-a-cuisiner/Boites-repas-pour-plats/Avec-des-legumes-non-coupes/Boite-de-repas-Pasta-pesto/p/F2023101800127050000,Mealbox | Pasta pesto,F2023101800127050000,€,5.89,,"Zucchini 57%, green beans 15%, yellow onion 13%, cherry tomato 12%, seasoning mix 2,5% [salt, pine nut, cheese powder (MILK), onion, dextrose, garlic, parsley, basil, fat powder (glucose syrup, certified sustainable non hydrogenated palm oil, MILK protein, stabilisers (potassium phosphates, sodium citrates)), natural flavouring (contains: MILK), marjoram, flavouring], garlic 1,2%.",A,"Ce classique italien ne peut manquer à l'assortiment ! Mais nous ne serions pas Delhaize si nous n'y apportions pas notre touche saine. Nous ajoutons donc des haricots verts, des courgettes tendres coupées en dés et des tomates cerises fraîches.",['https://www.delhaize.be/medias/sys_master/products/hcf/hb8/12942636744734.jpg']
https://www.delhaize.be/fr/shop/Fruits-et-legumes-frais/Noix-et-fruits-secs/Noix/Noix/Noix-de-cajou-Mexicana-Bio/p/S2023071300714110000,Cashew nuts | Mexicana | Bio,S2023071300714110000,€,6.29,,"CASHEW NUTS* 94%, spicy seasoning 3,7% [salt, glucose syrup*, onion*, maltodextrin*, cumin*, oregano*, paprika*, garlic*, yeast extract, cayenne pepper* 1%, extract of paprika*, antioxidant (citric acid)], non hydrogenated sunflower oil*. *From organic agriculture.",C,Ces noix de cajou bio enrobées d'un mélange d'épices mexicaines ont un goût surprenant.,"['https://www.delhaize.be/medias/sys_master/h47/h62/12551836172318.jpg', 'https://www.delhaize.be/medias/sys_master/h41/h9f/12551836565534.jpg']"
https://www.delhaize.be/fr/shop/Fruits-et-legumes-frais/Noix-et-fruits-secs/Noix/Pistaches/Pistaches-Bio/p/S2023080200717590000,Pistachios | Bio,S2023080200717590000,€,7.39,,"PISTACHIOS* 99%, sea salt 1%. *From organic agriculture.",B,un goût et un croustillant uniques. naturellement. La torréfaction et le salage des pistaches leur confèrent signifie qu'ils ne sont récoltés que lorsque la peau bilobée s'ouvre Les pistaches Delhaize California sont naturellement ouvertes. Cela,"['https://www.delhaize.be/medias/sys_master/products/h5e/h54/12654617821214.jpg', 'https://www.delhaize.be/medias/sys_master/products/h70/h2b/12654618214430.jpg']"
https://www.delhaize.be/fr/shop/Fruits-et-legumes-frais/Noix-et-fruits-secs/Noix/Noix/Macadamia-sale/p/S2023081700719450000,Salted | Macadamias,S2023081700719450000,€,3.79,,"MACADEMIA NUTS 99%, salt.",C,Macadamia salé,['https://www.delhaize.be/medias/sys_master/products/h11/h9b/13112214650910.jpg']
https://www.delhaize.be/fr/shop/Fruits-et-legumes-frais/Boites-repas/Boites-repas-pour-plats/Avec-des-legumes-non-coupes/Boite-de-repas-Poivron-farci/p/F2023111000127660000,Mealbox | Stuffed pepper,F2023111000127660000,€,5.49,,"Zucchini 31%, roma tomato 22%, red bell pepper 19%, red onion 11%, concentrated tomato puree 7.5% [tomato, acidity regulator (citric acid)], raisins 5.3% (sultana raisins, non hydrogenated sunflower oil), seasoning mix 2.7% (paprika, salt, coriander, cumin, roasted garlic, cardamom, mint, oregano, chili pepper), garlic 1.3%.",B,Kit de cuisine pour la préparation de Poivron Farci Ajoutez vous-même : 15 g de basilic 150 g de feta 250 g de riz brun 500 g de pou e poulet haché 3 cuillères à soupe d'huile (d'olive) 100 ml d'eau,['https://www.delhaize.be/medias/sys_master/products/h7f/hbd/12675461775390.jpg']
https://www.delhaize.be/fr/shop/Fruits-et-legumes-frais/Noix-et-fruits-secs/Vrac/Chips-Banane-Bio/p/S2024051400717480098,Chips | Banana | Bio,S2024051400717480098,€,1.75,,"Banana* 68%, non hydrogenated coconut oil*, sugar* . * From organic agriculture",D,CHIPS BANANE BIO 200G,"['https://www.delhaize.be/medias/sys_master/products/hca/h5c/12664160321566.jpg', 'https://www.delhaize.be/medias/sys_master/products/hc5/h99/12664160714782.jpg']"
https://www.delhaize.be/fr/shop/Fruits-et-legumes-frais/Noix-et-fruits-secs/Fruits-secs/Autres-fruits-secs/Baies-Goji/p/S2024062600717210098,Berries | Goji,S2024062600717210098,€,5.75,,"Goji berries 99.98%, antioxidant (sulfur dioxide) (SULPHITE)",C,DLL BAIES DE GOJI 200G,"['https://www.delhaize.be/medias/sys_master/products/hb4/h9f/13108053016606.jpg', 'https://www.delhaize.be/medias/sys_master/products/haf/hdc/13108053409822.jpg']"
https://www.delhaize.be/fr/shop/Fruits-et-legumes-frais/Noix-et-fruits-secs/Fruits-secs/Autres-fruits-secs/Baies-Goji-Bio/p/S2024062600717470098,Berries | Goji | Bio,S2024062600717470098,€,6.19,,Goji berries*. *From organic agriculture.,C,DLL BAIES GOJI BIO 200G,"['https://www.delhaize.be/medias/sys_master/products/h40/h85/13028356882462.jpg', 'https://www.delhaize.be/medias/sys_master/products/h7e/hb0/13028357275678.jpg']"
https://www.delhaize.be/fr/shop/Fruits-et-legumes-frais/Boites-repas/Boites-repas-pour-plats/Avec-des-legumes-non-coupes/Paquet-de-guacemole/p/F2024090900146990000,Package guacamole,F2024090900146990000,€,4.49,,"Avocado 62%, tomato 19%, lime 14%, seasoning mix 2.2% [maltodextrin, onion powder, salt, red bell pepper, paprika powder, acid (citric acid), cumin seed, garlic powder, oregano, chili pepper], garlic 1.3%, red pepper 1.1%.",A,"Grâce à la polyvalence du guacamole, il y a toujours de nouvelles combinaisons à découvrir.",['https://www.delhaize.be/medias/sys_master/products/h0c/hac/12844959399966.jpg']
